Utterance,Emotion
"Gunther, y'know what, I am a terrible waitress, do you know why Im a terrible waitress?",anger
"Perhaps. Now Im curious, at what point during those girlish screams would you have begun to",neutral
I-I do though.,sadness
I will!,joy
"Umm, about that-that-that last move where the woman tripped you and then pinned you to the floor, what-what-what-what would you do next?",fear
"Yknow, I dont have an appointment, but I sure could use a physical.  Are you sure youre okay?",neutral
I'm not a dropper!,anger
After she gave me that big speech?!,surprise
"Hey Monica, it's Joey!",joy
"Maybe hes intimated by really smart, strong, successful women.",neutral
Forgive me? You haven't been taking my calls in a week!,anger
At the vet.,neutral
"And four ninety-nine for a pillow top queen set, who cares about the divorce, those babies will sell themselves.",anger
I mean theres no way Joeys gonna make it in time.,fear
That's OK.,neutral
"See, I told you they dont swim.",neutral
"Well, the cat... the cat turned out to be Paolo's cat!",neutral
Really?!,surprise
No! No Joey! U-N-I-sex.,joy
"No, Phoebe, Ill tell you what, if you get ready now Ill let you play it at the wedding.",neutral
You see what men do! Dont tell me men are not nice!  This is men!!,anger
"Ohh, well, this is just perfect!",anger
"So-so if anyone has-has a better suggestion, let's hear it!",anger
"Oh yeah? Well, howd she take it?",neutral
I dont care.,neutral
You betcha!,joy
"Yeah, but when the baby comes shes gonna want to move.",neutral
"Eight and a half hours of aptitude tests, intelligence tests, personality tests... and what do I learn?",disgust
"What do you think you're gonna do, have sex with her right here    on my couch?",disgust
Oh?!,surprise
Two.,neutral
"Okay so you mean no as in, ""Gee Chandler, what an interesting idea. Lets discuss it before we reject it completely.""",joy
"Good, good, good, good, good.",joy
"Oh, c'mon Dora, don't be mad...",neutral
Are you sure?,neutral
Can we please turn this off?,sadness
"Well, I dont really know what that is, but",neutral
"Well, it would be easier to move just right across the hall. Wait a minute, unless youre thinking about Naked Wednesdays.",neutral
"Ohh, let me see it! Let me see your hand!",surprise
I didnt think you were gay. I do now.,joy
"Look, Ross, you have what you want, youre back with Rachel.",neutral
"Oh umm, theres also a book here by a woman named Wendy Bagina.  What is that?",neutral
"Yeah, so, uh, so, uh, what's the deal with this father guy, I mean, if someone was havin' my baby somewhere, I'd wanna know about it, you know?",neutral
"Oh, youre welcome a million.",joy
Hes not here right now.,neutral
Hi!,joy
"Ok, go quick!",fear
"Well, that makes me feel so good.",joy
You mind if I,neutral
I think you look fine.,neutral
"I'm, I'm really sorry.",neutral
Would you like to call somebody?,neutral
I-I think everybodys pretending they dont hear you.,neutral
"Yeah, maybe, but I dont think I even care.",sadness
"Yknow, like the thing when you put the phone in your pants?",disgust
Man that was great! Huh? Can you believe how long we threw that ball around?,joy
Oh  oh no just stopped to throw up a little bit.,sadness
"No, Pheebs, listen, if you decide to do this, well be supportive like crazy.",neutral
Which is why,neutral
"Okay, Ben, I wont tell your daddy that you had ice cream for dinner, if you dont tell about our little bonking incident.",fear
"Look, the truth is, I haven't felt this    way about anyone since Rachel, ok?",sadness
"Well, he better not come by here. He cant see the bride in the wedding dress.",neutral
"Theyre just ten blocks away, if I run, I can make it.",neutral
Shhhh!,anger
"Oh, um, Chandler?",neutral
Ok.,neutral
"Uh, well yeah-yeah, I've got all of that going on.",neutral
Marry me.,neutral
"Here, come on, lets ahh, lets try it again.",neutral
Its me Rhonda!,neutral
"I hope you dont think Im crazy but I feel like I was meant to pick this up, do you believe in that kind of thing?",joy
Are you mocking me?,anger
You wanna go down to the office right now?,neutral
"Noo!  Oh, its okay, its okay, baby, baby, baby.",fear
I dont care! I wanna meet this guy who's the best sex she ever had!,joy
I guess I didnt really think about it.,neutral
Wait. Give him a minute.,neutral
"Oh thanks, but listen, I was just at Monicas and she and Chandler had a big fight and theyre not moving in.",sadness
"Ohh, I know one thing!",joy
"Yeah, yeah. You can do it to.",surprise
It's been fourteen and a half minutes and you still have not said one word.,anger
"Okay, y'know your not though. Let's go.",neutral
Oh my God!,surprise
"All right, you have yourself a deal.",neutral
Go back in time and listen to Phoebe!,anger
"Oh come on, by age seven kids have already seen orgies.  Was it just me?!",surprise
He doesn't speak much English.,neutral
"Oh. Oh, its beautiful. I see it now.",joy
"Okay now Joey, y'know that since you're returning all of this stuff right after the audition you're gonna have to wear underwear?",neutral
"Oh, shes gonna love that!",joy
Okay. (Goes over and fluffs up the pillows on the couch.,neutral
"I tell ya, that has never happened before.",fear
"Oh hey, Pheebs!",joy
Yes! You are so smart!  I love you.,joy
"Yeah, and it really freaked me out! And after a while I even tried to hurt you and it just spurred you on.",sadness
"I know.  Yeah, his name is Pat.",neutral
Eh.,joy
"Well, maybe it wont work out. Maybe Ross wont like her personality.",sadness
"Hey, you know who used to have nails like that?",neutral
So how are things going with Paul?,neutral
Is not.,anger
"Plus, y'know, I think it should be Joe.",neutral
"Ahh, I just got out of a big relationship, Im not looking for any thing serious.",sadness
About what?,neutral
"Ooh, you nailed the Old Lady!",surprise
You stole them from me!!,anger
"And its not fake, its totally brutal.",neutral
"Oh no wait, oh no, the elastic on my underwear busted.",neutral
"Well, I did my best to convince him that Im not some crazy girl who is dying to get marriedIm just going through a hard time.",neutral
You're there for her.,neutral
"Okay. Okay, heres a good one of us.",joy
What could I have possibly done?!,anger
Does that seem like something you can do.,anger
"Ohh, I mean its just so realistic!",joy
"Okay, yknow what, you were right, you were right.",sadness
Does Monica still turn on the lights in her bedroom?,neutral
I was wondering if you would consider coaching me for it?,neutral
"As bad as that went, I actually enjoyed myself. I think that Im going to apologize for all of the stupid things I do.",neutral
Im next!,anger
"Well, I assume Ill have to take showers with him, but y'know, thats true of any job.",neutral
"Ugh, can you believe that guy!",disgust
"Yes, I do.",neutral
"Oh no, I know I couldnt see it either at first, but its right umm  Ross, I lost it again.",joy
"Ooh! I'm sorry! I think, I THINK, that may have missed the table!",joy
Come on you gotta have one!,surprise
"But we haven't seen each other since then. Well I land in China, guess who's in charge of the dig.",surprise
"Well, okay. Would-would you get me a",neutral
I did not cry my eyes out!!,anger
It was in my room all night!,anger
I was always Joanne.,neutral
Now it also says here that you lied about your sexual preference before marriage?,neutral
"Yeah, about 300 guys I went to high school with.",neutral
"Well, I'm totally over it Chandler. Friends forever! Don't come out here!",anger
You're flingin'-flangin' right I am!,joy
": Im sure as hell a dancer, its no use Marge will never go for me.",sadness
"Oh, my ex-wife didnt work, unless you call turning into her mother work. Fine. Tomorrow night then.",neutral
"Well, its a long story.",neutral
"Well, just until we find an energy source to replace fuel.",neutral
"Well, I don't know what else to do.",sadness
Regular or decaf?,neutral
"See that scientist in the classes, he and I used to play together all the time in grade school, but now Peter!",neutral
"Just make contact, smile!",anger
I am. I'm,neutral
I played bad on purpose guys.,joy
Cat.,neutral
"Oh my God!! Do it!! Honey, youve waited",surprise
I totally understand.,neutral
"Oh, sure, they love us over there.",neutral
"Oh, wait a second! I didnt say I wasnt free!",surprise
Thanks.,neutral
"Okay, good, good, good, cause, good, cause I was kinda having second thoughts too.",fear
What the hell happened on that beach?!,surprise
"Wow, it looks like a, like a holiday card yknow, with the tree in the middle and the skaters and the snow.",joy
"You had to do it, didnt you? You couldnt just leave it alone.",sadness
"Oh don't be sorry, that's part of your job here to give your opinions and then I take credit for them--I'm kidding.",neutral
"Now that youre on youre own, youre free to look as stupid as you like.",anger
Would,neutral
Here?! Now?!,surprise
Do you really want to throw that all away over a room?,sadness
Oh my god.,surprise
"As I recall when we got married, I saw the groom in the wedding dress.",joy
Look what I got! Look what I got! Look what I got!  Can you believe they make these for little people?,surprise
"Well, I heard that you thinking about asking Phoebe to move in with you and I thought maybe, we should have a talk.",neutral
Behind my brother's back?  ... is exactly the kind of crazy thing you won't be hearing from me.,anger
"Ross, let me show you where the guest room is.",neutral
"I dont have anything against the beautiful guest room, especially since everybody we know lives about 30 seconds away!",anger
"Well, every- single- second is like that with Aurora.. and I've just wasted about thirty-five of them talking to you people, so, uh.. Monica, can you help me with the door?",neutral
"All right, well the place was closed. Ill just copy it later.",neutral
That was a great scene! And-and-and that slap looks so real! How do you do that?,surprise
"All right, let me in.",neutral
"She, she buys clothes from stores that I'm intimidated by the sales people.",anger
You are so cute!,joy
"Okay, look, just do it gently.",neutral
Straight up over your head!,anger
"Wow! Oh-okay, look pal, I am",joy
I thought he was with you.,neutral
"Look, Im just gonna be across the hall, we can still do all the same stuff.",neutral
Whats he talking about?,neutral
"Oh yeah well, Im sorry about that too, but what are you going to do?",neutral
"Okay, its not, its not.",neutral
Why do you want to see my hand?,neutral
"Whoa, I'm sorry. Excuse me. We had this cart.",anger
You wanna go in the bedroom? Its a little more comfortable.,neutral
Yknow I dont understand why they didnt cry. It was a beautiful speech.,sadness
"Honey, if you wanted to do that, you might as well just gotten him a fish, you know how fish freaked me out!",disgust
Okay. All right.,neutral
"A strong, confident woman.",neutral
"So, I guess this is over.",sadness
Okay I understand.  I wouldnt want to be proved wrong either.,neutral
"Im just saying that yknow, someday Ross is gonna meet somebody andhes gonna have his own life. Right?",sadness
What the hell!,anger
Joey? Joey Tribbiani?,neutral
"Listen Joey, seeing as you've got the most experience, I want you to take these dancers and show them the combination.",neutral
"Oooh, wrong answer.",neutral
"Oh, I uh, just came by to pick up my skull. Well, not mine, but...",neutral
Oh God!,surprise
"All right, well Im gonna put my sweats back on.",neutral
Come on Joey!!!,anger
"Oh, anyway, they say, if we want, we can see it tonight.",neutral
"Hey, did I do these neat enough?",neutral
"Oh, that would be Monica.",neutral
Whose is it?,neutral
"Youre right, thanks for keeping me honest dad.",neutral
So you like the short hair better.,neutral
Hey! Y'know that teacher who had a baby with her student?,neutral
To see if know what these guys are talking about.,neutral
I have no name.,neutral
Sorry. Monica and Chandler are making love.,neutral
"Y'know what Gunther, go ah, go ahead, Im-Im talking to ah, .  This is the part where you say your name.",neutral
Thank you. All right.,neutral
"Okay, well then bring her in.",neutral
"Oh yeah, Smokey Joe here got half way to the highway and collapsed.",anger
"So, we did okay at the strip club, right?",neutral
Wow.,surprise
$4.50 please.,neutral
"All right, let's do it!",joy
"I don't know, you don't wanna mess with corn nuts. They're craaazy.",neutral
"Uh Phoebe, what she makesthats uhtheyre sock rabbits.",neutral
Frannie was the one who found your,neutral
"Ross , foot on the floor or come over no more!",neutral
You're so pretty.,joy
"Baking it didn't help, huh?",neutral
"Because if you feel uncomfortable with your friend dating someone you work for, there are always ways to fix...that.",anger
"Oh, you said it Mike.  Aw! There's got to be a better way!",anger
Wow!,joy
"Im sorry, its just that youre so incredibly beautiful.",surprise
"Oh, my baby!",sadness
"Honey, I was wondering....",neutral
Why wouldnt ya? Erin is great! Then-then theres you guys.,joy
And based on the fact that Mr. Geller is intravenous drug user.,neutral
"Well, she would take her keys and try to jam them",neutral
I dont think so.,neutral
"Honey, honey, people are looking.",sadness
"I guess I just figured that somewhere down the road, we would be on again.",sadness
I cant believe were living here!,sadness
"Oh, its okay. I dont",neutral
"Uh,",neutral
"He-he was with me umm, were playing a little game, yknow? Hide and seek.",neutral
What?! Over a stupid room!,surprise
"You know, Barracuda was the first song I learned to play on the keyboard.",neutral
Huh? Uh,neutral
"What, you can do it in the parking lot of a Taco Bell, but you    can't do it at a doctor's office?",anger
He's in the bathroom. I don't think you wanna go in there!,anger
"Someone was in the lady's room, I couldnt wait. I left the lid up for ya though.",neutral
"Can you believe it? I mean, don't I seem like somebody who should be doing something really",anger
"Oh, youre switching apartments?",surprise
It looks like a women's purse.,neutral
Hope you had a nice flight.,neutral
"Ross, tonight was about the two of you getting along.  Oh, would you just see my chiropractor, already.",anger
"Hi. Ohhh, you got my message.",neutral
Are we okay now?,fear
Are you intrigued?,surprise
Sure!,joy
Later is not good enough.,anger
WhatWhy wouldnt you want me at your wedding?,anger
"What, he doesnt like Josh?",surprise
Thank you for a delightful stay.,joy
Okay I-I just have to stop by my place first.,neutral
"Okay well then, Ill fire him today and you go out with him for another week.",neutral
"God, its gonna so weird like when I come home and youre not here.",sadness
"Or not. Uh, Rach, why dont you just move in with me?",neutral
How does that sound?,neutral
Oh yeah? Howd yours happen?,neutral
"""Cant, its not there.""",neutral
Hey right!,surprise
OK.,neutral
Yeah I guess Ill let it go.,neutral
All right!,joy
"""You wanna go over to Joey and Chandlers?""",neutral
What? So now Im not allowed to fire him?,surprise
"Yeah, but you're making me look bad!",anger
Hes in room 816.,neutral
"Thats okay, Im cool over here. Ill catch up with you later, Joey.",neutral
"Okay, that's it. I cannot make this decision! It is",anger
What do you have against the beautiful guest room?,anger
What is that?,surprise
"I mean Ill have to check with him first, but Ill think hell be cool with it.",neutral
"I just came over to drop offnothing. So that weekend kinda sucked, huh?",neutral
Ahh. Thank you!,joy
You listen to me!,anger
I want to keep one.,neutral
"no, um, I'm sorry, don't tell me, I don't think either answer would make me feel better.",sadness
"Yeah, come here!",neutral
Tell me about it.,neutral
She spent three hundred dollars on art supplies.,anger
"No.  And then I called him, and he wasnt there.",neutral
I say we go with,neutral
"Wow, this is so cool, you guys. The entire city is blacked out!",surprise
"No-no, sorry. Cookies are good, thanks.",neutral
Ah Joey.,neutral
I have no idea what you just said.,neutral
"Really well. Yeah. Surprisingly well. Yeah, she didnt cry. She wasnt angry or sad.",neutral
"Hi!  Hi!  Hi. Has umm, anyone seen Chandler?",neutral
"Come on, Lydia, you can do it.",neutral
"Well lets see, there was the guy with the ferrets, thats plural.",disgust
"Oh, I found him. He was Paolo's cat.",neutral
"Hey, why dont you guys go get portraits done by a professional photographer.",neutral
Every moment is precious.,sadness
Diane Keaton.,neutral
"then a little more custard, and then bananas, and then I just put some whipped cream on top!",neutral
What?! You got us evicted!!,anger
I dont care!  I dont care!!,anger
And monkeys cant write out prescriptions.,neutral
"Did you, did you",anger
Not at these prices.,anger
"No, I meant with the dropper over here.",neutral
"Push 'em out, push 'em out, harder, harder.",joy
"I know! Hey, hows Chandler doin?",neutral
I didn’t look at it. Stupid baby’s head was blocking most of  it.,anger
"To tape the game? You do this every time Ross, youre",disgust
Sure.,neutral
"Ross! What are you I'm sorry sir. I just, I think he just really likes you.",neutral
"I gotta go Monica, my uh, my sushi's here!",neutral
So what does this mean?,neutral
"[Joey and Ross make impressed faces] Then raspberries, more ladyfingers, then beef sautéed with peas and onions, [Joey and Ross look like somethings wrong.]",neutral
You stole them from me!,anger
Cant I just look at the handles on them?,neutral
No more Joey and Chans.,sadness
"Oh, mostly fashion, so there may be models here from time to time, I hope thats cool.",neutral
Cut it out Ross! I hate to have to save your life and kick your ass in the same day!,anger
Can I tell you a little secret?,neutral
Little village people.,neutral
"Once you, once you betray me, I become like the ice woman, yknow.",neutral
Okay wait!,anger
Im so exited!,joy
That's always fun to be.,joy
"Oh, it's so much more fun with you.",joy
"Well, I did put a lot of thought in the tape.",neutral
"Come on, wussies!",anger
"Yes, yes it is. Its uh  Every time on the lips! Why?! Why on lips?!",anger
I just have to clean that up.,neutral
"Okay, very cute braces. Anyway yknow what, the",neutral
"Oh,  I wish. No, you know he was just trying Ross's Hug and Roll thing.",joy
"Yknow you, really didnt have to take me to the airport.",neutral
But you will always be the guy who peed on me.,disgust
Stalin...Stalin...do I know that name? It sounds familiar.,neutral
"Yeah, it did.",joy
"Yeah, but without the costumes.",neutral
I think I brought back half of the beach in my hair. It was so much easier when I used to shave my head.,anger
"Whats all this about you guys fighting?! Is this really over a room?! I mean, that is so silly!",anger
"Oh, I can't believe my sperm have low motility because, let me tell you, when I was growing up they sure seem to be in a hurry to get places!",surprise
Diet Coke,neutral
I think I know whats going on here.,disgust
"Im sorry, but I just wrote the best dance song for your wedding. Check this out.",neutral
"Man,",neutral
And I don't even know how it happened.,sadness
"Push 'em out, push 'em out, way out!",joy
"You're not? See, that's why you're so great!",surprise
Then why are you smoking?,disgust
"Can you, can you hang on a second?",neutral
"""You are ideally suited for a career in data processing for a large multinational corporation.""",anger
You think?,neutral
"Honey, we dont have any bears here.",neutral
Hey. When you guys were kids and you played,neutral
"Fine, youre right.",neutral
"Oh, poor Lily.",sadness
"Here we go, here we go.",neutral
"I give up you guys, I don't know what I'm going to do with this thing!",anger
Wow! Spinning that sounds like fun.,joy
I mean what?,anger
"You know, this isn't fair.",anger
"Look, not that I enjoy talking about people who I went to high school with, cause I do, but umm, maybe we could talk about something else?",disgust
"Okay, okay. Umm, well ah, maybe he, maybe he feels awkward because you are my boss.",neutral
"Yeah, but what if it's not? What if there    is a reason why we can't have a baby?",fear
I just want this to be  about what it is!,joy
You guys are always hanging out in my apartment!,anger
The patient Im looking for has a broken leg and is in a wheelchair.,neutral
"Yeah, well I might be if I had the supplies! I mean, I could do all this stuff. Only I don't.",anger
Yeah!,joy
"There was a ring, in a box, on my nightstand, after you left, it was gone!",anger
This sounds like a hernia. You have toyou-youGo to the doctor!,surprise
"Do you remember when you first came here, how you spent two weeks getting trained by another waitress?",neutral
You cant leave! I have your shoe!,sadness
"Yeah, oh hey, you are right on time.",neutral
"Oh, oh, a quality, good, because I was worried you guys were gonna be vague about this.",neutral
I got in there myself once.,neutral
"Uh yeah, where-wheres the guy who decides whos pictures go up on the wall?",neutral
"Oh, yeah. Go for it man, jump off the high dive, stare down the barrel of the gun, pee into the wind!",joy
"Oh, Chandler, Wayne.",neutral
"Oh myThis is so embarrassing. Oh my God, Im never gonna get massaged again!",fear
"Oh, these are gonna go in my permanent collection.",joy
"You're like, like the anti-Paolo!",anger
Why would the baby creep me out?,anger
"Y'know I mean I-I-I'm an actor, I don't have the discipline that takes, y'know?",sadness
"Well actually, I know what time Chester and Marcia said.",neutral
"Okay, okay, okay.  Ill get the bagels.",neutral
"Then, uh, then we got dressed, and I-I... I walked her to the-  -the bus stop... I'm fine.",neutral
"She's not gonna make you wear one of those big plastic cones, is she?",fear
It's not the same.,neutral
"Uhh, yeah. She uh, she uh, she uh might've mentioned him.",neutral
"Well, y'know, monogamy can be a, uh, tricky concept. I mean, anthropologically speaking-",neutral
Excuse me.,neutral
Have you figured out what started the fire Mr. Fireman?,neutral
"Yeah, cheerie-o!",joy
What am I making him by the way?,neutral
A doctor at this hospital?,surprise
"You be Mr. Gonzalez, and Ill be uh, Mr. Wong.",neutral
"You cant ask us son, thats cheating.",neutral
Good.,neutral
Someone on the subway licked my neck! Licked my neck!!,disgust
Oh my God! Monica!,surprise
No. Sorry.,sadness
"I also have to find a new video store, a new bank, a new adult bookstore, a new grocery store",disgust
"It was a ""Wendy's!!    """,anger
Together? Like-like to people?,surprise
I feel violated. And not in a good way.,disgust
"See, yes.",neutral
Hi there.,neutral
Dude! Dude!,surprise
"Yeah, listen uh, I want you to make sure you tell Chandler that he couldn't have been more wrong!",neutral
"Listen Joey, I got a problem, I just got a call from my dance captain, he's having a relationship crisis and can't get out of Long Island.",neutral
Of course they’re listening to you! Everybody listens to you.,neutral
Okay?,neutral
Do you really?,neutral
Come in.,neutral
Chandler?,neutral
Whats that smell?,disgust
"Alright here’s something, it says to try holding the baby  close to your body and then swing her rapidly from side to side.",neutral
"No, just knowing you're gonna be there is enough.",neutral
"Excuse me little one, I have a very solid backhand.",anger
"Oh my God. I cannot keep having this same fight with you Ross! Look, urrgh, maybe we should take a break.",sadness
"No! No-no! He is totally incompetent. I called the chef who recommended him to me. He said, ""Ha-ha! Gotcha!""",disgust
"Don't worry, after a while he'll tune it out.",neutral
Could we talk about this later?,anger
"Huh, whats fish hooking...   Thanks man, that would have been really hard to describe. What is that taste?",neutral
"Hey honey, you got the kind with the little girl, you said we were gonna to get the kind with the baby.",anger
"Me taking care of you is no problem, huh?",neutral
"Okay, look, Ross, I realise that my Father is difficult, but thats why you have got to be the bigger man here.",neutral
"Now, dont hold back.",neutral
"All right, don't be shy, any suggestion will do.",anger
"Eh, Monica it, it feels so weird, y'know, Chandlers your friend...  Oh!",surprise
"Oh, thank you.  Hey, hey.  Rachel!!!!",joy
Why don’t you phase it out?,neutral
"Okay, it's missing something. Ooh, I know! Umm, okay.",neutral
"Very cold, hard, unyielding, y'know nothing,",neutral
"Well not clients, lovers. But lets just yknow, try it again. Come back and-and well work through it.",neutral
I have the lung capacity of a two year old.,neutral
"So, you heard it, you repeated it, so that must mean you wrote it.",neutral
Awkward? Why should he feel awkward?,surprise
"Rach come on, what?",neutral
I know! Phoebe is gonna love dressing them in these!,joy
I'm trppd... in an ATM vstbl... wth,fear
"Oh, how bad is it?",sadness
"No, it was a fight.",neutral
"No, no resentment, believe me, it's worth it.",neutral
"A Magic Eight ball?! You can't be serious, you can't make this decision with a toy!",disgust
Does this mean were gonna have to start paying for coffee?,surprise
I dont think the next patient is very far along.,neutral
Im sorry Joey.,sadness
"I think that uh, yours is a question with many answers.",neutral
"Oh, everything went great.",joy
Could've been a peach.,neutral
Bumpy?,surprise
"Oh, are you sure?",surprise
"Oh well, thats uh, a little later than I uh, generally care to stay, but sure!",joy
OH.MY.GAWD!!!,surprise
"I mean gosh, Chandler what you did, it's, it's a wonderful thing and I really appreciate it.",joy
"No, there are great pictures of you standing next to a guy whos going like this",neutral
And uh maybe you have to get used to it.,neutral
