Utterance,Emotion
"Hey buddy, do you think I can borrow your uniform this Thursday?",neutral
Yknow?,neutral
"Oh, my-my new assistant was very happy that I hired my new assistant.",neutral
Okay!,joy
I totally forgot about tonight and the fact that were supposed to,neutral
"Ah, he cant make it, he said he had to his...  Whoa-oh!",surprise
Four hours? You guys have been doing this for four hours?,surprise
"Good God Bing Iwell I cant say Im altogether surprised, I saw the way she looked at you, and there was no love there.",sadness
"Thats not true, there are great pictures of us!",surprise
This woman's living my life.,anger
"Oh, all right.",neutral
Its not!,sadness
"Even when I found outumm, all right, well let's just say I found something out something about someone and let's just say she's gonna keep it.",neutral
"Wow, that was kinda brutal.",surprise
"Ross, we can handle this.",neutral
"Oh, Chandler, look. You and Monica are meant to have children.    I am sure it's gonna be just fine.",neutral
Its your joke.,neutral
"Let's  I was justyeah, right.",joy
I love you too.,joy
No. No! No! No!,sadness
"Oh thank you so much Mr. Kaplan, thank you so much.",joy
I warned you...,neutral
Okay. No. But thanks.,neutral
"C'mon, we're roommates!  My eyes!! My eyes!!",disgust
"Well, I think it's perfect.",joy
"No, I dont.",disgust
"Oh! Ohhhhh! Oh! Phoebe, come here. Aw, this is my new bed. You gotta feel this bad boy.",joy
"Oh, I gotta get to work. So call me later?",neutral
"I dont know, I hardly ever say that about people.",neutral
He went out with my wife!,anger
Its a great class.,joy
A new grocery store.,neutral
"Ooh, an ink stain! Hey, can I watch how you get this out?",joy
So your brother's straigh huh? Seriously.,surprise
"Gary, I'm here to report a crime.",neutral
What?!,surprise
"Here you go, maybe this'll cheer you up.",joy
"Yeah! Totally! Totally, and you?",joy
Remember when you where a kid and your Mom would drop you off at the movies with a jar of jam and a little spoon?,neutral
"Well, if you want, you can work here.",neutral
Here you go honey!,joy
"Joe Stalin. Y'know, that's pretty good.",joy
"Stupid, useless Canadian money!",anger
This is the final boarding call for Flight 664 to Yemen.,neutral
All right! Lets do it!,joy
"Yes, I do have to go to the bathroom.",neutral
"Oh, that is so sick.",disgust
No! No!  No!  No-no-no-no.,joy
"Well, were really not that close.  Okay, so I guess this is uh, good-bye then.",neutral
"So, this is my idea: you and me spending some quality time together.",neutral
"Look, I dont feel like dancing, I feel like having a drink. Okay?",sadness
Oh my God! I overslept! I was supposed to be on the set a half an hour ago! I gotta get out of here!,fear
"Okay, well you are just gonna have too, okay.",anger
"Do you wanna, do you wanna send this one out together?",neutral
No-noReally?!,surprise
Try telling my wife that.,sadness
-Peaches?,neutral
"Oh great! Hey-hey Joey, do you want to check out pictures of me and Mona ice skating?",joy
"Oh yes! Bye Bye Birdie, starring Joseph Stalin. Joseph Stalin is the Fiddler on the Roof.",joy
"Jeez, man did you fall.. Hi! So ah, did ya, did-did-did ya fall high?",surprise
"Oh anyway, I just wanted to say how wonderful I think you are.",joy
"All right, hold on okay? First thing's first.  Okay, now did Ross sit",neutral
"You know, I think I was sixteen.",neutral
"Excellent! Excellent! And uh, finally, are you into any weird stuff yknow, sexually?",joy
Exactly! Unisex!,neutral
"Well okay, let this be a lesson to all of you, all right.",neutral
Yeah! Got it!,anger
"No, but it'll be OK, they're pretty cool, my brother's straight so. . .",neutral
Rachel always cries!,anger
Do we have any... Do we have any thoughts here?,neutral
"Hey, Joey, could you pass the cheese?",neutral
"Oh, my mom called, theyre gonna run our engagement announcement in the local paper, so were looking for a good picture of us.",joy
"All right, so are we not having dinner at all?",sadness
What are,neutral
"Oh, oh thanks. Alright well, now that I'm up I'm going to go    to the bathroom.",neutral
I also said number one.,neutral
He,neutral
"Ya see, its just, see I was a regular on a soap opera yknow?",neutral
All right here. Watch me execute the three Ps of championship play. Power.  Precision.  and penache.,neutral
I cant find garbage bags!,anger
"Hey, oh, you know that guy who's been following me? I talked to him today.",neutral
Like me tiny doctor!,anger
"I mean, I remember a time when",sadness
"Oh, you didnt have to come in with me.",neutral
No! No! I wanna see you take-off.,neutral
"Okay, well maybe not on those levels.",neutral
Rachel? Do you smoke?,neutral
"Oh, my Bing-a-ling. Ill wait for you. Do you even know how long youre going to be gone?",sadness
I dont think Id be comfortable with any of my old lovers there.,sadness
"Then he comes over!  ""Im so worried about you."" Uck! Be a man!",disgust
The guy left this.,neutral
"Joey, get out of the fridge.",anger
Me too.,neutral
"Yes!! Yes! Yes! Yes!! Thats my Dad, thats Frank! Yeah! Im sorry Im getting all flingy.",surprise
Okay you two are asking the court for an annulment?,neutral
"Yes, now is when you swoop!",joy
"Oh, youre kidding me!",anger
Sit!,anger
"And then you realised if you  bitched about it, then you  would stop cooking, and you  would have to make your famous baked potato and Diet Coke.",anger
"See my friend-my friend, Rachel, she wants to be set up.",neutral
Right!,surprise
"Because I can, and my Mom couldnt, and I thought y'know, I figured that was something I got from our Dad.",neutral
I-I-Im leaving the show?,surprise
"Oh, Larry.",neutral
"Hi, is Molly here?",neutral
"Well, we should go.",neutral
"July. Umm,",neutral
"Yeah, I can say that I have a conference and you can say you have a chef thing.",neutral
"Check it out. Okay, I can play this when the guests are coming in. Okay.",neutral
How could you not tell me that she has hair?,surprise
There shouldnt be all this rules and restrictions!,anger
"Oh yeah, probably at the end.  Oh my God! He only took pictures of my breasts!",surprise
"Ill get everybody else , finally we can start celebrating my Im sorry, uh apparently Ive opened the door to the past.",neutral
"Remember, evolution?",joy
"What, now?",surprise
"Hello? Hello? Oh! Rachel, it's Paolo calling from Rome.",joy
"Molly, ah, do you mind giving us just a minute?",neutral
"Oh, oh! It's on again!",joy
"Great, all right, okay, and Monica ask me to make the drumming stop.",neutral
"No, I mean tonight, in the building. Suddenly. Into our lives.",neutral
"Kay look, if I have to go to the doctor for anything its gonna be for this thing sticking out of my stomach!",anger
Hey Joey!,joy
You deal with it and move on!,joy
"Well, I-I gotta go break up with Bonnie.",sadness
"Oh, what are you going to do, follow me down there?",anger
"Okay ladies, that ends todays class, and lets remember, lets be safe out there.",neutral
"Because I already got a Mother and a Father who cannot stay in the same room together, okay, I dont wanna have to have a separate room for you too!",anger
"Oh, theres banana on it.",neutral
"Come on Treeger, dont say that.",sadness
Good-bye Chandler Bing.,sadness
Could you press up too please?,neutral
It tastes like feet!,disgust
Done!,joy
"Thats it? Well I saw that! Ohh-ohh-oh, thank you.",joy
I-I studied evolution.,joy
"Yeah listen so, I thought I was getting better, so on my way home today I stopped by this guitar store and",neutral
"What are you still doing here? She just broke up with the guy, it's time for you to swoop in!",surprise
"Yeah, you were, but you decided to make salmon because you had some left over at the restaurant.",neutral
"Yeah, well, is that",neutral
Damnit woman were losing precious time! Now do you want this mans blood on your head?,anger
"In the afternoon. Mr. Zelner came into my office after lunch. He put them on my desk, and then I put a",neutral
Howard's the,neutral
This rooms available.,neutral
"Hi! Hey, Pete youre back! Hey, check this out.",joy
"Oh my god, I am losing my mind.",anger
"Thank you, Happy Holidays.",joy
You dont need to smoke.,neutral
"Oh yeah, whos playing?",neutral
Come on! The time we were all waiting in line for,anger
"Op, this is saved.  Gift shop.",neutral
Your not doing it.,neutral
Got a job on a river boat?,neutral
"Ohh, thats a good one.",joy
"Okay, after I get rid of this dirty diaper Leslie, Ill set you up with a clean one.",neutral
You didnt bring,neutral
Yknow she has a face Ross!,anger
We're in a relationship?,surprise
So when do you imagine you gave them to me? In the morning or in the afternoon?,anger
"Oh its umm, its tofu cake. Do you want some?",neutral
"Yeah I can!  And dont think I dont, because I do! I mean all the time, you betcha!",joy
Thats not your regular dry cleaners.,neutral
"No look, I have, I have lots of clients that make the same noises you do!",neutral
"So um, so what's up, you came to see me yesterday.",joy
"I mean, you live alone, you don't walk around naked.",neutral
Wait!,surprise
Do you have a chair with your name on it?,neutral
"Oh really? Well, maybe you and I go out for drinks?  Youre the other one right?",neutral
Hi honey.,neutral
Hey!,joy
"Although yknow, he-hes a private guy.",neutral
What?! Youre crazy! Theres nothing sexual about the noises I make!,surprise
"I dont know! But maybe if we keep that drawer shut, itll die.",disgust
I guess I was just so worried about having to...    come here and do... 'that'...,sadness
C'mon up.,neutral
Thats a good idea! I bet they have one of those wind machines! Yknow,joy
"Yeah, there you go!",joy
You're definitely scaring here.,neutral
"Although, I should probably tell you, shes a porn star.",neutral
"Shh. He did it. He told her off, and not just about the kiss, about everything.",neutral
"You shouldnt be arguing over who gets credit, you should be arguing over who gets blamed for inflicting this horrible joke upon the world!",anger
Im serious!,anger
"But she said she's looking for someone, and someone is gonna be there tonight.",neutral
"Well, my apartment isnt there anymore, because I drank it.",neutral
And what is his name?,neutral
"We really werent great at being guys, but you know why?",sadness
It's creamier.,neutral
"Why, exactly?",surprise
They published my paper.,joy
"No. But I got Knicks tickets for you, me, and Chandler.",neutral
"Ah, which ever is closest.",neutral
"Well, it just hurts so bad. I uh",sadness
Thats what Monica said.,neutral
Somebody seems to be missing being the hostess.,neutral
"Oh, Im sorry. Of course I mean that. Interesting idea, umm, talk about it, but no.",disgust
"Yknow, give him my flower.",neutral
"Well, I-I guess I gotta go.",sadness
One more game?,neutral
"Oh uh, ordinarily I would love too, but I am just swamped right now.",neutral
"Because you know, you could make little puppets out of them, and you could use them in your theater of cruelty.",anger
Joey! Hes working!  You would look,anger
Phoebe! I can't believe you gave them money! I thought you agreed it was totally unreasonable that they asked me for that money!,surprise
"I don't know. We're talking about whipped fish, Monica. I'm just happy I'm keeping it down, y'know?",disgust
"So I moved everything around and then I forgot where it, where it went back and I'm sorry, I'm very sorry, I'm sorry, I'm sorry.",sadness
"Im not worried, Im uh, Im fascinated.",fear
Flexible hours.,neutral
"Yeah, but they didn't ask me!",anger
"Oh God, Im so sorry.",sadness
"I-I-I saw you on stage talking to that beautiful woman, yknow Sarah?",neutral
"Oh yeah! Yeah! Dont worry about me, Ill be fine!",sadness
Because were girls.,neutral
"All right, but I should warn you, Im not going. Im going.",neutral
"Well, I just called Joshua",neutral
Great. Hes doing great. Dont you worry about Chandler.,neutral
But what does that gonna do...,anger
Nice to meet you.,neutral
"Okay, I got that. Ill escape over there. Ill come back over here. All right, come on",neutral
Thats not true!,anger
"Well, you know, you have to take a course. Otherwise, they don't let you do it.",neutral
Car accident.,sadness
Which one? Was it bald or was it tall?,surprise
"That's nice. Get out Let's go, come on.",disgust
So its really a question of,neutral
"...and then Zana, just let one rip!!",surprise
Joey!,surprise
Bob. Bob! Bob!!!  What the hell are you doing?!,surprise
"Ross-Ross-Ross-Ross! Stay away from that guy , and that guy . And that oneDude! Theyre all huge!",fear
Put Joey on the phone.,neutral
"Uh, okay, and then you buzz Ross and I.",neutral
Oh thats so exciting!,joy
"On no! No! Its not good-bye, Im not leaving until you get on that plane.",sadness
"I think its great. Its great. Yknow, theyre thinking of changing the name of this place.",neutral
"So what do you say we take a break, we go outside, and we'll figure this out when we come back?",neutral
"Oh no, yeah no, that parts great!",joy
"Okay, where in the hell did you get that?!",surprise
"Ok, look, maybe I should just go.",neutral
Really?,surprise
"Well there really wasn't much time to get used to it, you know what I mean?",joy
Any luck?,sadness
Its my sister.,neutral
Its Joey!,surprise
Because I don't work at the Szechwan Dragon.,neutral
"Hey, y'know what you should do?",neutral
Youre not the fan whos dying are you?,neutral
"Hey, hey, Yertle the Turtle. A classic.",joy
"Yeah, like in a cab...",neutral
"Yeah! Sure! Yep!  Oh, y'know what? If I heard a shot right now, I'd throw my body on you.",joy
"Oh, no-no, yknow I absolutely adore Rachel its just that, well it might be a awkward for you.",sadness
"Yeah, I’m not so sure.",neutral
"When youre done over there, we kinda have a situation over here too.",fear
"Hey, that woman's got an ass like Carol's!  What? Thought we were trying to find stuff.",joy
Because uhwe-wewe split up. Monica and I split up. Hold me.,sadness
Canceled?!,surprise
And you know what?,neutral
Well maybe there is one thing you can do.,neutral
"Can-can I get your autograph, Im your biggest fan.",joy
No way are you cool enough to pull of Clint.,disgust
With a mahogany sleigh bed and bedside tables with flowers on them all the time!,joy
What stupid thing did you do?,neutral
"Monica, let's go. Come on now people, woman in labor.",neutral
Ahhhh!!,surprise
"Okay, look.",neutral
This is broken!,anger
But that doesnt mean you have to talk about it!,neutral
"Well, y'know, you and me, it had to end sometime.",sadness
"Hey Ross! Listen, do you want to go see that new Imax movie on tide pools?",joy
"Okay, is this lamp in the same place?",neutral
"Oh okay, lift it straight up over your head!",anger
"Monica, number one, I dont think Ben understands the concept of bribery, and number two, I...   What?!",surprise
I totally understand.  Can I,neutral
Chandler sucks! He couldnt have gotten this good!,surprise
Laundry. Huh. Is that my new nickname?,joy
"Im never gonna find a roommate, ever.",sadness
"All right, all right.",anger
Well now-now youre just talking crazy.,joy
We just want you to think it through.,neutral
Thats crazy.,surprise
"Really? Ive been thinking, this is crazy, I mean dont, dont you think we can work on this?",sadness
Whats the matter?,neutral
"Three, Two, One!",neutral
"Okay, I-I d'know, you-you just- you have a quality.",joy
Define me!,anger
Westminster Abbey!,joy
I dont want to say.,neutral
You kissed my best Ross! ...Or something to that effect.,anger
"Umm, hows it going with you guys?",neutral
"Come on, I'll only use my left hand, huh?",anger
"Rachel one brunch is not gonna solve anything. You gotta face it, okay were never gonna get along.",anger
"I know I have this weird thing where I want everything to be in the perfect place, but I'd never expect you to worry about that.",joy
"Oh, what? What was it?",surprise
So ask me what I did today.,neutral
This is going in your book?,surprise
Because I think about shaving it all off again sometime.,neutral
A lesson in the importance of unagi.,neutral
"All right, ok, I gotta go.",neutral
"Ohh, I've always wanted to go to this culinary fair that they have in Jersey!",joy
"Y'know, it's just gonna be the two of us, she spent all day taking care of my monkey...",neutral
I did.  But it came at a price.,neutral
"Rach, I told you everything I knew last night!",anger
Dont care what people say.,joy
"Oh my God! He's trapped in an ATM vestibule with Jill Goodacre!  Chandler, listen.",surprise
"O-kay. Look, it, it was stupid.",sadness
"Aw, come on! It'll be years before I forget you!",neutral
Oh there it is.,neutral
"It's ah, step-ity, step and jazz hands.",sadness
"Im, Im freaking out!",fear
"All right, we'll start off slow. The only thing you have to do tonight is come up with the name of your main character.",neutral
"Wow, you guys, this is big.",surprise
So what are you saying.  I should run him under hot water and bang his head against a table?,surprise
I think I have an old band uniform from high school.,joy
"Uh-huh, yeah.",neutral
Im just going to say hi to the lads. All right?,neutral
Oh yeah!,joy
"Well, as old as he is in dog years, do you think Snoopy should still be allowed to fly this thing?",sadness
"Pheebs, hows it going?",neutral
No! No!! Its me! Its me! I-I didnt want to make any noise!,fear
"So you see, Molly, what people don't understand is that acting    is a discipline. It takes a lot of hard work.",neutral
I bet he can.,neutral
"Oh, I found it!",joy
Sweetie thats it.,joy
"Ah,",neutral
Peach pit.,neutral
Ice coffee? Tell me its ice coffee!,surprise
"Umm, she Rach, not it, she.",neutral
"Ok, given your situation, the options with the greatest chances for success would be surrogacy, or insemination using a sperm donor.",neutral
"Uh, I dont know.",neutral
"Noo way, Kevin.",joy
"An-an-anyway I-I just wanted to say that since Im getting your brain when you leave the show, I was wondering if there was any tips you can give me",neutral
"Okay Rach, before anything happens  I just want to lay down a couple of ground rules.",neutral
"Whoops.  Oh, hey, do you need help with that?",neutral
"And plus, it'll give me something to do.",neutral
"Oh you know uh Kash, really liked you the other day. He said he thought you were charming.",neutral
"You guys, Im sorry, could you please talk a little slower?",neutral
Everythings ruined. My bed. My clothes. Look at my favorite blue sweater.,sadness
Will you stop!,joy
"So, thats it?",surprise
"Alright. There's a theory, put forth by Richard Leakey-",neutral
"Yknow, you look familiar. Do I know you from somewhere?",surprise
"Yeah, anything goes, except ah, eye gouging and fish hooking.",neutral
"Ooh, you know, I had a grape about five hours ago, so I'd better split this with you.",neutral
"Oh my God! If you say that one more time,",anger
"No-no, they just had a big blowout over what to do with my room.",neutral
"No, I mean happy.",neutral
So why dont you give me your number?,neutral
Do,neutral
Dont you worry. I have nothing to hide.,neutral
Are you Phoebe Buffay?,neutral
"I mean, I dont feel like I even have a girlfriend anymore.",anger
"Uh actually, sorry I cant even make it. Im seeing Mona again tonight.",neutral
"Yeah, I know.",sadness
"Car's waiting downstairs, I just wanted to drop off these copies of my book for your friends. Anything you want from Lisbon?",neutral
I gave you my,neutral
Phoebe! Come on! Lets go!  Come on!  Why arent you dressed yet?!,anger
"Oh, let me guess some idiot on a cell phone wasnt paying attention?",neutral
and that was all before 10 oclock.,neutral
"Thats good. I got to admit, I thought it was something else.",joy
I believe you know my husband.,neutral
Oh what do you know? Virgin!,anger
And it can't be Joey.,neutral
"Umm, honey, look he just came over to....",neutral
Monica! What,surprise
"Oh hey, show them the picture of your uterus.",neutral
"Cause lets face it, were at Monicas.",neutral
Oh and I need to talk to you.,neutral
I cant believe Im going to lose this job!,sadness
I broke it.,sadness
"Uhh, 9.",neutral
"Oh!  Sorry. Uh, Ive got those plans with Phoebe, why?",neutral
Could the waiters gather around to hear tonights specials?,neutral
"All right, bye!",anger
"Well, I'm not I'm not at all surprised they feel that way.",neutral
Oh down please.  I-I hate to be a ball buster can I just do it?,joy
"Yeah, y'know how I have you guys, well she doesnt really have any close friends that are just hers, but last week she meet this woman at the gym, Susan something, and they really hit it off, and I-I-I think its gonna make a difference",joy
"Well, people!",sadness
Okay please tell me that this is just one of your jokes that you do that I dont get.,joy
What is the worse part?,neutral
"Im going to keep dating him Mother, and theres nothing you can do about it!",anger
"Because, I dont care.",neutral
"Joey, you have to tell her what’s going on! And what did it  look like?!",surprise
"No, but he told me, he thinks your a fox.",neutral
"You remember not having sex in high school, right?",sadness
"So, hes just a nice guy. You really think this Mark doesnt want anything in exchange for helping him?",joy
I can and I will!,anger
"Hey Ross, will you pass me that knife?",neutral
No!,surprise
She is not  Shes gay. Oh my God. She is,anger
"Okay, I gotta go.",neutral
Wait! What?! No!! Elevator!! No!,anger
Where's Joey? His mom's on the phone.,neutral
"So you can like, bite, and pull peoples hair and stuff?",surprise
I am,neutral
I dont know. Should we try it?,neutral
"Rach, Im sorry, but you didnt give me any contracts!",surprise
"Okay, all right, I think youre great, I think youre sweet, and youre smart, and I love you.",joy
"Yknow, people should be able to sleep with who ever they want, whenever",neutral
"Uh, yeah, if you want too.",neutral
"Well, Ive got a project for you thats a lot more related to fashion.",neutral
"Hey Joey! Aww, you remembered even though you're a big star!",joy
"Look, honey, I have tried to make nice, it doesnt work.",anger
"Well, if you dont have anything to copy, why are you going down there?",neutral
Thanks Mon!,joy
"Yeah, are you just going down there to gawk at that hot girl with the belly button ring again?",anger
"I mean, what about those",neutral
They did it right there on the couch.,neutral
"Great! Okay, if youll just excuse me.  So, did you hear something you liked?",joy
"Soo, ah, Eric, what kind of photography do ya do?",neutral
I dont know. Do-do you have any clothes on?,neutral
Write a movie!,joy
Whats up with Gene?,surprise
Guess what?,neutral
"I mean, yknow, Im not really that comfortable dancing with a We-he!!",joy
The Hardy boys?,anger
A little.   Now youre talking.,neutral
Ohh!,surprise
"Ginger. Im talking to Ginger, so....",neutral
"Yeah, okay, my bad.",joy
"Come on! Come on! Here, okay-okay, you see this?  This tiny thing that looks like a peanut?",joy
"Okay, good-bye. Good-bye.",sadness
London baby!,joy
"Okay, okay, but Rachels gonna be here too, cant I just ask her this stuff?",neutral
"Oh-ho, and yes, the guy that enjoyed my name so much he felt the need to make a little noise every time he said it.",anger
"You really, really need to get some sleep, honey.",neutral
"Okay, umm, it's this tragic love story between Cathy and Heathcliff and umm, it takes place on like these really creepy mores in England.",sadness
"Yes, they can stay with us.",neutral
"Whoa-whoa-whoa! Emily,  honey, okay?",surprise
That is so silly.,joy
"Okay, which one of you guys is Gunther Central-Perk?  Hey, Joey?",neutral
"Ow, no woo-hooing, no woo-hooing.",anger
"Yeah, I-I considered that. I just know it would make me happy.",neutral
Lucky sixes....,neutral
Joey... Switzerland?,neutral
"Why, does she have a bad personality?",neutral
This is so great! Now we can enter into doubles tournaments!,joy
"All right, so we werent",neutral
Ah! Well! There you go! Last to know again! And I'm guessing... since nobody told me... this is Paolo.,joy
Phoebe I think he would notice if you didnt have a baby in nine months!,anger
We dont know.,neutral
"Im telling you, you never gave them to me.",neutral
"Uh sure, sure.",neutral
"Nice to meet you, Chandler Bing",neutral
"Oh. Well, Ill right you everyday.  15 Yemen Road, Yemen.",neutral
"Oh, you got me.",neutral
"Umm, all righty, before we get started I justI need you to state for the official record that you are in fact Frank Buffay.",neutral
I can't believe you would say that!,sadness
Theres just so much pressure.,anger
"Aw, all right take this bed, you can make other friends.",joy
"Keep in mind, he's never used this product before, you're gonna see how easy this is to do.",neutral
I thought I was making him filet mignon?,surprise
What contracts?,neutral
Uh Rach,neutral
I would really love it if I could do both.,neutral
I can't write!,anger
Whered you get too? We lost you after you opened up all the presents.,neutral
"All right, look, heres the bottom line Ross, this is fixable, if we act fast, okay.",neutral
"Man to uh, me.",neutral
Where there is no fear of commitment.,neutral
Oh my God! That is so good!,joy
No thats what you do when you want to get the truth out of someone.,neutral
You went through all this time and effort to make this tape for me!,sadness
Because shes not gonna get to keep the babies.,sadness
Whoa!,surprise
"Honey, it isnt good luck.",neutral
Why?! Why?! He said hed call. Why hasnt he called?,sadness
The reason he just said.,neutral
"Okay, heres where we go to the live shot of Times Square, nice work everyone thats a wrap!",joy
