Utterance,Emotion
"Ooh, I dont know. Probably the smell of freshly cut grass.",neutral
I love you Phoebe.,joy
Oh! Maybe its because Im on television. Im an actor on,joy
"Sweetie, with you its gonna be different. The sex is gonna be great, cause you-you guys are in love.",joy
"Oh, Bob, he was nothing compared to you. I had to bite my lip to keep from screaming your name.",sadness
"Maybe its crazy in a perfect world, a world without lab coats and blazers, but you not in a perfect world, you in a museum now.",neutral
"Oh, I think I saw some in here.",neutral
"No, I would see you looking embarrassed because they are",anger
Count it off.,neutral
"She is kidding, but don't ever disagree with her again. Okay, now I'm kidding!",joy
The universe said I was going to meet a nice guy and thats what they gave me?,anger
Excellent! What Rachel has shrewdly observed here,joy
Yes I did! And I put a little,anger
"What. Oh no, you just rolled over the juice box.",sadness
Really? A purse?,surprise
"Come on Ross be realistic, y'know? If I did write something, what are the chances I could get those guys to star in it?",sadness
"Yeah, I'm sorry too. But, I gotta tell you, I am a little relieved.",neutral
"And if she didnt take it, and I didnt take it; and you  didnt take it, then who did?",anger
Dr. Drake who?,neutral
"Tommyyyy! Say, whats your favourite thing about summer?",joy
"Gunther, I quit.",sadness
"Okay, its coffee.",neutral
"We share a wall! So either hes great in bed, or she just likes to agree with him a lot.",neutral
"Huh? Yeah, fine, invite whoever you want.",neutral
I got new sheets!,joy
"Yeah, thats our baby.",joy
The joke sucks!,anger
"Okay, I gotta ask, who calls us that?!",anger
Uh-huh! Why do you think it takes me so long to answer the door?,joy
Hot coffee!!!,surprise
There's something new in the bowl.,surprise
"Yeah, I mean, come on Ross, no one will even notice. I mean they’re probably not even listening!",neutral
I came with Paul!,anger
Its my turn!,anger
I understand: who would cancel an actual date to go to a fake bachelor party?,neutral
"Welcome everybody, welcome to Amazing Discoveries!",joy
"So, um... where did Paolo come from?",neutral
"I, ah, I never said hate, I was very careful about that.",neutral
Love is the best medicine.,joy
"Sure, I'll go check on Emma.",neutral
"Uh, what was that?",surprise
No. No-no. No. What would,anger
Chicks dont swim.,neutral
"Uh, it's 2:30 in the morning!",sadness
Yknow what? You are right?!,surprise
What is it?!,surprise
Do I know why were rushing?,neutral
"Awww, hotel toiletries from Japan.",joy
And Ross.,neutral
Hang on buddy!,anger
Previously on Friends.,neutral
"Yeah, I-I heard.  I think its great!  Ohh, Im so happy for you!",joy
"Listen uh, not that Im yknow insecure about my manhood or anything yknow, but I think I need to hook up with a woman like right now.",neutral
"Umm, thank you for meeting with me.",neutral
Hi Jill!,joy
"Yeah, you should, really.",neutral
Again. Yknow what? I think we all did.,sadness
Like theyre taking it off the air?,surprise
"Not this hospital, Im going to sue you!",anger
Then don't touch one!!,anger
"Okay, I was thinking we should have a beautiful guest room, right?",neutral
Okay. I just wanted them to hear it from somebody else.,neutral
"Hey! Guys, this is Tabatha .  I'll see you tomorrow.",neutral
"Mom says it's all of Manhattan, parts of Brooklyn and Queens, and they have no idea when it's coming back on.",anger
It was just so awkward and bumpy.,neutral
"Hey, you guys! Guess what?",joy
"Yes, that is cool. Because I have models here y'know......never.",neutral
You bet! Whats the part?,joy
"Yeah, I understand.",neutral
If anything I'm making you look better!,joy
"All right, then you'd better show me some of that too then.",neutral
"I'm still on ""no.""",neutral
I-I’ll go tell her now before Ross  finds out and I’ll be gentle.,neutral
You said she was bald.,anger
"Oh we did, and you still have all your lamps.",neutral
"But um, I dont think its anything serious.",neutral
"Hey, you dont have to smile. You just have to dance.",neutral
Is that too much to ask after six years?!,anger
Its got all of these layers.,neutral
Its Joshua.,anger
I was shrieking... like a Marine.,neutral
"How can people do that?...  Oh, you guys, look! Ugly Naked Guy got gravity boots!",surprise
Yeah! You wanna come?,joy
Whats fish hooking?,surprise
What?! Excuse me!,surprise
"No Joey, look. Trust me, all the men are wearing them in the spring catalog. Look.  See look,",neutral
We said seven!,anger
Im Doctor Monkey!,anger
"Yeah, like that thought never entered my mind.",neutral
"Oh, its bad. Its really bad. The only thing in there that isnt burned is an ass. Which I do",sadness
Fine.,neutral
"Anyway, I figured after work I'd go pick up a bottle of wine, go over there and, uh, try to woo her.",joy
"I'm going,  and I'm gone.",neutral
"Come on over here, sweetheart.",neutral
I can't wait to be with you!,joy
Go ahead.,neutral
Fine!,anger
"Ohh, I'm gonna be on the news!",joy
She's distraught.,neutral
"Well, she seems very nice and everything, but that whole thing about her coming all the way down here, just to see if I was okay?",anger
That part was perfect for me! I can't believe I didn't get it!,anger
"I know, but that creep that I went on that date with goes to there so I have to find a new one.",disgust
Thanks!,joy
Fine! Im sorry for your loss!,anger
Thank you.,neutral
My God! What happened to you?,surprise
"Joey, this is the awkward part.",joy
She's not much of a phone person.,neutral
"Yeah, she was bald, shes not now.",neutral
Were not even shootin them anymore?!!,surprise
"Hey, check me out, Im a slut!",joy
"After that? Yeah! No, I mean if I can help.",surprise
I sure did.,neutral
"Yeah, like I could",neutral
"Its uh, right through there.",neutral
All weekend? That's a whole lotta naked.,surprise
Why would the little girl creep you out?,anger
Its-its hot,neutral
"Okay, nows not the time Joey. All right? You can yell at me tomorrow.",sadness
"See ya Phoebe! Oh and hey, thanks for chipping in!",joy
"Yknow Im just gonnaI, I am gonna make this up to you!",joy
There you go sweetie...     This isn't over.,neutral
"Monica, your dad just beeped in, but can you make it quick? Talking to Rome.  I'm talking to Rome.",joy
Or maybe you would see me looking embarrassed because you are talking on the phone with your crotch!,disgust
"It have a fear of heights, you go to the top of the building!",fear
I shared my puddin which you man!,anger
"Ohh, yeah she really wouldve wanted to be there.",sadness
"Oh, and somebody can get those leather pants shes always wanted!",joy
Theres nothing sexual about this?,anger
Oh Willies still alive!,surprise
Really?! That's what you heard?  You said that?,surprise
"Bing my boy, were gonna get you over this.",neutral
"Actually, I'm reading it to the baby.",neutral
"Well, I umm, I mean this is just off the top of my head now, umm but I have this friend.",neutral
"And whats cool is, the character is from Naples, right?",joy
If you give up every time you'd have a fight with someone you'd never be with anyone longer thanOhhh!,anger
"Yeah, yknow. Happy holidays from Mona and Ross. Itll be cute, okay?",joy
Are-are-are Rachel and I not as close as you guys?!,anger
"Why, nobody good?",neutral
That's,neutral
"Hey-hey, whos your friend?  Hey!!",joy
"No! She had the ring on, she seemed so excited, and then she  took her breast out.",anger
"Okay.  God yknow, if someone told me a week ago that I would be peeing in Joey Tribbianis apartment",joy
"Oh God, do something.",anger
"Oh, I wish there was something I can do to make you feel better.",sadness
Its the semi-finalsof herbotchy ball tournament.,neutral
Not a problem.,neutral
Oh my God! Youre a 30 year old virgin!,surprise
"Well, up yours too!",anger
"So Chandler, have you heard about Monica's secret boyfriend?",neutral
"Ah, the forbidden love of a man and his door.",neutral
There you go!,joy
"Well, why dont you tell her to stop being silly!",anger
Hey!!,anger
When I get up there Im going to kick some ass.,anger
Power company guys?,anger
Rachel was just helping me out. My head got all sunburned.,neutral
Ive just been thinking about how my baby and I are gonna be all alone.,sadness
"Oh, come on! I dont care! Come on! Whose is it?",joy
Oh myOh good God!,surprise
Oh my God! Calling from Rome!,surprise
Maybe you need sex.,neutral
"So I, I told Rachel it was just gonna be the two of us.",neutral
You cant marry him!,anger
"A lot of things happened on that trip that we should never,  ever talk about.",neutral
Yes.,neutral
"Oh, better, actually. Y'know I-I-I think I finally figured out why we were having so much trouble lately.",neutral
So what did you do today Pete?,neutral
"Good. Good. Not that we dont want you to stay, obviously youre welcomeHow much more homework do you have?",neutral
Theres like-theres like 300 bucks in this one!,surprise
"People, people, people.",neutral
"Yknow its like uh, Biology!",neutral
"Oh, yknow what, that might be okay even if it was just kind of a fling, that might be all right with Rachel.",neutral
I talk in my sleep.,neutral
"Oh, and the chilliest has carpel-tunel syndrome.",neutral
"Listen uh, Id prefer it if you didnt call me Joey.",neutral
Whoo-hoo!,joy
We can't do that.,neutral
"Y'know, I can't believe I'm getting my nails done!  And",surprise
You idiot!!,anger
"Hey, Phoebe.",neutral
"OK, try this salmon mousse.",neutral
She goes and makes a date with a guy on the same night she has plans with me?,anger
Bye guys.,neutral
Okay .,neutral
"No wait, look. Look! I'm sorry, it's just I've never even",fear
We're here!,joy
"Ah, oh God. Oh, honey, oh that's OK.",sadness
Thats just the way it is.,neutral
"No, no. He said ""When are you gonna grow up and start being a mom?""",neutral
Have fun.,neutral
You weren't trying to entice me with your nakedness.,joy
Oh my God! What happened here? Did you do all this?,surprise
'Kay?,neutral
Shes not pregnant. Its Rachel. Rachels the one whos pregnant.,neutral
"Bye, Gene.",neutral
I don't know.,neutral
We did!,joy
I love you both.,neutral
Rachel?,neutral
It's throwing and catching!,anger
More tea?,neutral
"Well honey, what about you?",neutral
Those contracts absolutely had to go out today!,anger
I guess.,neutral
"Ill bet your thinking, Whats an intelligent girl who wants to be in fashion, doing making coffee? Eh?",surprise
You don't know anything.,anger
Save it.,neutral
Absolutely!,joy
"Thank you, I need that.",joy
Shut-out!!,surprise
"Well, thats just the way that goes.",neutral
Its like the end of an era!,sadness
Damnit!,anger
And I too am just a love machine.,neutral
"Im really glad you guys are okay but, I just keep thinking what would happen if-if you two  actually had hooked up.",neutral
Yeah! C'mon!,joy
"Wow, it is easy.  Now, I can have milk everyday.",surprise
Chandler what do you say?,neutral
"All right, well finish your coffee; lets go.",neutral
"Where are you guys going? Come on, one more game!",surprise
Oh my God! Joey!,surprise
"Well, yeah.",neutral
Wow! Youre a lot sturdier that Chandler. He crumpled like a piece of paper. So how was youre trip?,surprise
What is it? Hey!,sadness
"Im sorry Chandler, yknow you are such a sweet guy and I, I dont want to hurt you.",sadness
And we could have a roll top desk with comment cards on them so people could say how much they loved staying here!!,joy
"Oh good God, Ross! How the hell do you do it?",surprise
"Oh no, my dad's a doctor and he would always tell me just horror storiesabout ghosts and goblins who totally supported the princess's right to smoke.",neutral
"Its between us and the sea, Ross!",neutral
"Oh, my maple candy!",joy
"Well, we are fond of the silliness, but we also have a soft spot for the love.",neutral
"Of course I have! What do you think, Im some 30 year old virgin?",anger
"No seriously, yknow the contracts I gave you, did you overnight them?",fear
Oh that was a real person?!,surprise
Ohh I wonder if that dude.,neutral
Second date!,joy
Oh so-so you weren't trying to entice me just now with your-your nakedness?,surprise
"Uh, you gotta press the button.",neutral
"Well, you would know.",neutral
"No, no, no. What was that?",surprise
"Awww, stop. Come on. Now go shave that head!",neutral
No ... the leather sticks to my ass.,disgust
"I'm sorry, honey, I promise it will never happen again.",sadness
I might've said that.  Why is that funny?,neutral
"Well umm, if you have sometime yknow and maybe you might want to visit someone else",neutral
"Well, I heard Emma stirring, so I came to make sure she could    reach Hugsy.",neutral
Do you have a dressing room?,neutral
Yknow what? It,neutral
You guys feel safe.,neutral
Did anybody call for security?,neutral
Okay.  See?! I told ya!,surprise
Not once did we do that.,neutral
"Ohh, Im sorry.",sadness
"Hey, when the music starts up again, I was thinking of maybe goind into the robot, yknow?",neutral
"I mean, all Im asking for is just a little emotion!",anger
"What, you don't think they can hear sounds in there?",joy
"Oh, that sounds great.",joy
"Well, I've never been through the tunnel myself, 'cause as I understand it, you're not allowed to go through with more than one girl in the car, right.",neutral
"Yeah I know, and I bet you thought it would be weird. But its not!",joy
And how none of it matters when the people really love each other.,neutral
I totally dont know what youre talking about.,neutral
And how people will believe anything you tell them as long as its a compliment.,neutral
"Yeah, no kidding, this just proves no good can come from  having sex with Ross!",anger
"Ah...ooh! Well, looks like, uh, we kicked your butts.",joy
Why did I have to start working out again?,disgust
I'm,neutral
"I mean we-we told Joey, he cried his eyes out!",sadness
Im an actor. Im kinda getting my picture up there on the wall.,neutral
"Yeah, it is amazing it lasted that long.",neutral
That bitch!,anger
Phoebe just because I'm alone doesnt mean I wanna walk around naked.,neutral
"I actually had a topic in mind! Im, Im kinda going through a dry spell, sex wise.",anger
So he's calling from Rome. I could do that. Just gotta go to Rome.,neutral
Yes. Absolutely. A quality.,neutral
"Nooo, I had to return it to the costume place.",sadness
"Ohh, man! Chicago, is sooo lucky!",joy
"Oh. God, crazy Chandler. He spun me...off...the...bed!",joy
They'll see you talking to me and that's--I'm a hit!,joy
Uh-oh!,fear
"Hey, Chandler, why dont we talk this over at the Ranger game tomorrow?",neutral
"Okay, I know what I have to do. Ive got to go Red Ross.  Yknow, Red Ross!",anger
"Though late one night, not much light, I....",neutral
Okay. Oh but dont tell them Monicas pregnant because they frown on that.,neutral
"Oh right, Coach Ruben.",neutral
"Look sweetie, I could be the bigger man, I could be the biggest man, I could be a big, huge, giant man, and it still wouldnt make any difference, except that I could pick your Father up and say Like me!",anger
Hi. Y'know in England this car would be on the other side of the store.  Woo!,joy
Can I borrow the phone? I want to call my apartment and check on my grandma.  What's my number?,neutral
"Yeah well, Im-Im a slut.",sadness
"It's really a uh-uh three person game, y'know?",neutral
"You guys, can we please not watch this all right.",disgust
Im sorry I gotta cancel tonight baby,sadness
"Hey Joey, I want to talk to you.",neutral
"Oh, heres a great one.",joy
"If you wouldve let me finish, it goes on to say that hes probably not gay.",neutral
"Okay uh, for now, temporarily, you can call me, Clint.",neutral
Why should I help you?!,anger
"Ah, thats okay, thanks.",sadness
"Yeah, you didnt expect her to live there with a baby did you?",surprise
Hey! So how was the doctor?,neutral
"Hes not gonna make it, hes stuck in Chicago.",sadness
I am a gentle person.,neutral
Dont look honey. Change the channel! Change the channel!,disgust
From PS-129!,neutral
I mean hi.,neutral
"So uh, what are you in for?",neutral
You need to yknow make sure I dont have any horrible scars or tattoos.,neutral
Are you sure? Ill bet theres another flight to Minsk in like,neutral
With them Im one hot chicky.,joy
Will you call him?,neutral
"Well, she is going to know that you stole the joke.",anger
"Joey, what's it like on a movie set, huh?",neutral
I mean do we not have as much fun?!,anger
"Actually, nectarines, but basically...",neutral
You are now completely asleep.,neutral
I dont see the baby. Where is it?,neutral
Who? Who is it?,surprise
Ugh!,disgust
Yeah?,neutral
"Sure, your dresser is missing but this she notices.",anger
I dont know if youd understand.,neutral
"Well that's because you always sleep to noon, silly! This is what 9 looks like.",neutral
"The uh, the baby that hasn't been born yet? Wouldn't that mean you're... crazy?",surprise
"Oh my God, what happened?",surprise
Bye Phoebe.,neutral
"Y'know, Joey makes me sound like I'm, I dunno, this big.",neutral
You want me to just quit my job so that you can feel like youve got a girlfriend?,anger
"Love me, I need love!",anger
Im doing okay. I think its going well. Do you think theyre having fun? Am I talking to fast?,neutral
"Dont worry Phoebe, youre gonna meet someone. If I can meet a great guy, so can you.",neutral
"Yeah, um, Im, Im leaving now.",sadness
Me too!,joy
"Janice, what umm, what are you doing here?",sadness
"All right, I'm going. I'm going.",anger
Im sorry your husband cheated on you.,sadness
I'm sorry there wasn't better news from your test last week but I wanted to talk to you about your options.,neutral
"What do you mean, theyre not moving in? They-theyre still moving in right?",surprise
"I did! But the store wouldnt take her back! So then I took her to the shelter, and you know what I found out?",anger
Let me tell you about this chick I scored with last night! Oh no wait a minute that was you!,joy
Thats my wife!!! Get out!,anger
"All right, see you Monday.",neutral
"Thanks, Im glad you see it that way.",joy
"Uh, are you crazy? Are you insane? If you live with Phoebe, you two are gonna be y'know, live-living together!",surprise
"So big deal, so Joeys had a lot of girlfriends, it doesnt mean hes great in bed.",neutral
She mustve left.,neutral
Oh my good God.,disgust
"You know, ever since I was little, I've been able to pick up quarters with my toes.",joy
The three losers.,sadness
Mmmm. Good.,joy
Rachel has those in burgendy.,neutral
"Who, Josh?",surprise
"Good luck, and uh, take care, huh?",sadness
Much!,joy
Thats easy! You just have to think of him as a-as a jar of pickles that wont open.,neutral
"Hey, funny you should call.",joy
Oh I cant. Dr. Roger is coming over again.,neutral
And Im appalled for you by the way.,anger
"No-no-no, no!",fear
Yeah sure.,neutral
Miss? May I help you?,neutral
"Noo!! No! You thought, you actually thought I wanted to have sex with you?!",anger
"Now wait a minute, you be nice! All right? I didnt bring you here so you can ambush her.",anger
You talked to him. Are you crazy?,surprise
So what did he decide? Does your Uncle Nathan get an invite or not?,neutral
"Eww! Oh, its all dirty. You should throw this out.",disgust
"Yeah, get out!",anger
"Oh no, Bonnies the best!",joy
Sorry about that. Thanks for waitin'.,neutral
Like what?,neutral
"Ow! My ass. Okay. Okay.  Oh, shhh!",anger
"Oh, I didn't factor in the room tax.",surprise
No more J and Cs.,sadness
Coming through!  Oh! Coming through!  Oh! Hello! Hi!  No! Right! Coming through!,fear
"All right, I havent lived here in a while, so I have to ask you something.",neutral
"Um, can you roll your tongue?",neutral
"Phoebe, she doesnt know that you sneak out every night, she doesnt know that you sneak back every morning, and she doesnt know that youve been living with your Grandmothers for a week now.",neutral
But Rachel has an apartment.,neutral
Oh my God.,surprise
Whats your favourite thing about summertime?,neutral
"Ohh, welcome to an adult relationship!",joy
"Oh, just years of experience.",neutral
Because Im dumping him today.,neutral
We know you took so just-just save yourself the time and confess!,anger
"Yeah, most of the damage is pretty mostly contained in the bedrooms.",sadness
"Like-like umm, regular coffee, Tequila.",neutral
"Hey, dragon! Heres your tips from Monday and Tuesday.",neutral
"Yeah, I know...  ..I'm I'm just not that bright either.",sadness
Why dont you just stop doing stupid things? Then you wouldnt have to apologize.,neutral
I feel like were the only two people in the world.  Oops. Sorry.,joy
Oh? Why not?,neutral
"So thats two boxes of the Holiday Macaroons. On behalf of the Brown Birds of America, I salute you.",joy
Pants and a sweater?,anger
"Hey, you guys. Listen, Im sorry that I was hogging the game beforeOh my God! Your friends have some unfortunate initials!",sadness
What a wank!,anger
What are you doing? We're going to a hospital.,surprise
What do you got there?,neutral
Woo-hoo!!,joy
Yeah. Oh! Was how you invented the cotton gin?!,neutral
"I mean, that guy with the toe thing?",anger
"Look, I know I feel asleep before I could shower and now I dont have time!",anger
You are falling fast asleep.,neutral
"Well it turns out she ah, she wants to get back together with me.",neutral
"Yeah, Joe, I assure you if I'm staring down the barrel of a gun, I'm pretty much peeing every which way.",fear
The caterer rang and said it was going to be Chicken Kiev instead of Chicken Tarragon.,neutral
Oh my God. You guys! You gotta come see this! There's some creep out there with a telescope!,fear
"Oh no-no believe me, Im leaving as soon as possible!",neutral
Maybe you should.,anger
Feel better?,neutral
She is?,surprise
Who cares? I repel women.,disgust
"Well, that's sort of a given, but yes. Anyone else?",neutral
"Come, sit.",neutral
I just dont think arcade games go in the beautiful guest room. The beautiful guest room is gonna be filled with antiques.,neutral
Sounds like two people are really enjoying the Dewey decimal system.,neutral
Why?!,surprise
Were just celebrating that Joey got his health insurance back.,joy
This isnt funny!,anger
Excuse me?,surprise
"Okay, ah, see ya Pheebs.",neutral
"Yeah, I said what was okay when I thought she was some weird bald chick. I mean, y'know, that girl has hair got",anger
"Okay, good bye!",anger
"Yes, Bunny?",neutral
"Because of the weekend, we had a fight.",sadness
No. This is just part of a dare devil game that I play called wait until the last moment before I burst and die.,anger
"Umm, well I would have to say that it's a, it's tragic love story.",neutral
Someone in there?,neutral
Monica! Stop throwing it so hard! We're on the same team!,anger
I cant remember which sister.,sadness
What?! Oh.,surprise
"Okay! Feel free to look, but Im telling you those contracts are not on this desk.",anger
Are you kidding?,surprise
You are both idiots.,disgust
Arghh!!,disgust
"I mean, yknow, Im just waiting for the perfect guy.",neutral
"Oh my God. Okay, go into the bathroom, use whatever you want, just don't ever tell me what you did in there.",disgust
"Oh yeah?  If I cant, Ill knock five bucks off the price off the unit.",anger
"Okay! All right! Now, Chandler you-you wanna live with Monica, right?",neutral
"Why, mom?",anger
"Do you still have that, um, Navy uniform?",joy
The spitter.,disgust
I bought a restaurant and I would like you to be the head chef.,joy
"All right, II have to ask.",sadness
"All right, Carol, I need you to keep pushing. I need Excuse me, could I have this?",neutral
Yeah but we wont be able to like get up in the middle of the night and have those long talks about our feelings and the future.,sadness
"Umm, Gene.",neutral
"Uh yes, heroin and crack.",neutral
I'm gonna have to give him up.,sadness
"Anyway, look, I dont know about you and your jackets and your separate tables, but Ross is one of my best friends, and if I save him a seat, Im telling you, he",neutral
What do you need?,neutral
How about Joey... Pepponi?,neutral
"Okay, but the moneys good, plus you get to stare at Rachel as much as you want.",neutral
"What do you think of the Abbey, Chandler?",neutral
"Yeah, I guess so.",neutral
Isnt that mine?,neutral
Thanx.,neutral
Y'know you guys were a lot more supportive when I wanted to make denim furniture.,joy
"Oh, how did it go?",sadness
"So, you stole my joke, and you stole my money.",anger
"Well, maybe he had some kind of uh, new, cool style, that you're not familiar with.",neutral
Because your all gonna make up fake specials and make me cook them like you did the other night?,anger
"Good luck, with your girlfriend.",neutral
Thats a mailman! Thats,surprise
All right. We're gonna go.  It's not for another six hours. We're gonna go then.,neutral
"Hey, dinosaur guy, look at you, so sad. Come dance.",neutral
"She's living my life, and she's doing it better than me!",anger
"Chandler, theres a guy right over there.",neutral
"You just ahh, you just need more practice.",neutral
It's not a purse! It's a shoulder bag.,anger
"Oh, I guess. Except everything looks like jammies now.",neutral
"Im full, and yet I know if I stop eating this, Ill regret it.",neutral
So where did you study?,neutral
"This is the unit for you my friend. Sturdy construction, tons of storage compartments, some big enough to fit a grown man.",neutral
I cant believe youre getting married!,joy
Hell yeah! Ill marry you!,joy
Who's he sleeping with?,neutral
No. A break from us.,sadness
"This actor friend and he would kill me if he thought I was doing this umm, but umm would it be possible for him to get an audition for your movie say on Thursday?",fear
Bye.,neutral
