Utterance,Emotion
Do we have any... Do we have any thoughts here?,4
"Oh no-no-no, Monica would freak.  But to hell with that bitch.",0
Your not doing it.,4
No! Year! Happy No Year!,3
"So uh, youre not gonna be able to live here for a while, you ladies have a place to stay?",4
It is absolutely essential that you tell me what room the man my assistant described is staying in.,4
"She's living my life, and she's doing it better than me!",0
Then why are you smoking?,1
Look what I got! Look what I got! Look what I got!  Can you believe they make these for little people?,6
"Yeah, but you're making me look bad!",0
"On no! No! Its not good-bye, Im not leaving until you get on that plane.",5
"Look, the truth is, I haven't felt this    way about anyone since Rachel, ok?",5
What are,4
Phoebe!,6
Do you want me to be afraid of you?,4
"Well, she is going to know that you stole the joke.",0
Y'know in a relationship you have these key moments that you know you'll remember for the rest of your life?,4
"Oh yeah, probably at the end.  Oh my God! He only took pictures of my breasts!",6
"Well, the heart wants what it wants. Ill see you later.",4
You just wanna each take one?,4
"This way I'm just y'know, the exotic, generous stranger.",3
Yeah but we wont be able to like get up in the middle of the night and have those long talks about our feelings and the future.,5
"Okay, yknow what, you were right, you were right.",5
"Hey, did I do these neat enough?",4
"Oh, no-no, yknow I absolutely adore Rachel its just that, well it might be a awkward for you.",5
They'll see you talking to me and that's--I'm a hit!,3
"An-an-anyway I-I just wanted to say that since Im getting your brain when you leave the show, I was wondering if there was any tips you can give me",4
What happened?,6
"Stupid, useless Canadian money!",0
Huh?,0
After she gave me that big speech?!,6
There's something new in the bowl.,6
Okay you two are asking the court for an annulment?,4
I wanna see whats in your hand. I wanna see the trash.,1
Sure! I feel so bad for you. I broke my leg once too.,5
Hi.,4
Were not even shootin them anymore?!!,6
"Oh uh, as it turns out, we cant do it. Monica has to work.",3
"Hey, why dont you guys go get portraits done by a professional photographer.",4
"So uh, what are you in for?",4
"Okay so you mean no as in, ""Gee Chandler, what an interesting idea. Lets discuss it before we reject it completely.""",3
Car accident.,5
Show 'em how it's done.,4
"Okay, if you need the vacuum, its in my closet on the left-hand side. Ah, the garbage bags are next to the refrigerator",4
"Why, mom?",0
"Oh. Well, Ill right you everyday.  15 Yemen Road, Yemen.",4
No! No!! Its me! Its me! I-I didnt want to make any noise!,2
Im doing okay. I think its going well. Do you think theyre having fun? Am I talking to fast?,4
"Yeah, like I could",4
"Well, I added the 'exactly like me' part...",4
Thanks a million.,3
Oh  oh no just stopped to throw up a little bit.,5
"We really werent great at being guys, but you know why?",5
Bye Phoebe.,4
"Hey honey, you got the kind with the little girl, you said we were gonna to get the kind with the baby.",0
"No-no-no, no!",2
"Do you wanna, do you wanna send this one out together?",4
"Yeahno, just that last song.",4
Hey! Y'know that teacher who had a baby with her student?,4
Who? Me the attacker?,6
Sorry about that. Thanks for waitin'.,4
Hang on buddy!,0
Having a swim.,4
Yeah! C'mon!,3
"Ross , foot on the floor or come over no more!",4
"Well, dont think I havent noticed your potential.",4
"Oh, what? What was it?",6
"Magic 8 Ball, should I never see Rachel again?",4
"No, where did you study acting?",4
I say we go with,4
I gave you my,4
"You guys, Im sorry, could you please talk a little slower?",4
"Okay, I was thinking we should have a beautiful guest room, right?",4
"I don't to go through with this if it's going to raise the question of ""Us.""",4
What do you got there?,4
"Julie! Julie, isn't that great? I mean, isn't that just kick- you-in-the-crotch, spit-on-your-neck fantastic?",3
Help!,2
"Oh good God, Ross! How the hell do you do it?",6
Oo God!,5
Are you okay?,4
"Y'know, this kind of co-dependant, emotionally stunted, sitting in your stupid coffee house with your stupid big cups which, I'm sorry, might as well have nipples on them, and you're like all 'Oh, define me!",0
And we could have a roll top desk with comment cards on them so people could say how much they loved staying here!!,3
Well maybe there is one thing you can do.,4
Ohh I wonder if that dude.,4
"I think that uh, yours is a question with many answers.",4
Oh God!,6
I didn't think I could ever love again.,5
"Okay, fine.",4
What's up man?,4
"No look, I have, I have lots of clients that make the same noises you do!",4
"Do you still have that, um, Navy uniform?",3
"Oh no, yeah no, that parts great!",3
"Honey, we dont have any bears here.",4
"Well, then hes, hes probably just, out.",4
He,4
"Oh. God, crazy Chandler. He spun me...off...the...bed!",3
"Ooh! I'm sorry! I think, I THINK, that may have missed the table!",3
Me too!,3
I have the lung capacity of a two year old.,4
"Yeah, no, it was great.",3
"Where are you guys going? Come on, one more game!",6
"Hi. Ohhh, you got my message.",4
"And four ninety-nine for a pillow top queen set, who cares about the divorce, those babies will sell themselves.",0
"Yes, I'm familiar with the concept. We can just look for it.",4
Bob. Bob! Bob!!!  What the hell are you doing?!,6
I shared my puddin which you man!,0
Thanks!,3
Oh so-so you weren't trying to entice me just now with your-your nakedness?,6
You still haven’t told Rachel you weren’t really  proposing?,6
You got the clothes clean. Now that's the important part.,4
"Rach come on, what?",4
"Ah, Paolo, this is Phoebe.",4
"Its between us and the sea, Ross!",4
Why not?!,0
"Oh my God! If you say that one more time,",0
"She's not gonna make you wear one of those big plastic cones, is she?",2
So what do you say? Can I be your girlfriend again?,4
So what are you saying.  I should run him under hot water and bang his head against a table?,6
"I hope you dont think Im crazy but I feel like I was meant to pick this up, do you believe in that kind of thing?",3
"Yeah, but what if it's not? What if there    is a reason why we can't have a baby?",2
"Hey, you know who used to have nails like that?",4
"Oh, all right.",4
Damnit woman were losing precious time! Now do you want this mans blood on your head?,0
We can't do that.,4
Its like the end of an era!,5
Peach pit.,4
"Ross, please, I found the magazines!",5
What?! You said he was sweet!,6
"And um, what-what is that Ross?",4
"No its not! You want it, youre gonna have to win it!",0
No-no! Don't do it! Don't!,2
You idiot!!,0
"Joe Stalin. Y'know, that's pretty good.",3
"Hey, Chandler, why dont we talk this over at the Ranger game tomorrow?",4
Fish!,6
"Ohh, I've always wanted to go to this culinary fair that they have in Jersey!",3
Are we okay now?,2
"I can't belive it, I'm gonna be an aunt. I'm gonna have like a nephew.",3
See thats where I think that youre wrong. Weve been playing these babies man for man. we should really be playing a zone defense.,4
So what did you do today Pete?,4
You stole them from me!,0
"You know, this isn't fair.",0
Here. I need to borrow some moisturizer.,4
The charity's on fire!,2
"Now that youre on youre own, youre free to look as stupid as you like.",0
"Wow, you guys, this is big.",6
What-what are-what are these?,6
"Well, I-I guess I gotta go.",5
"Oh no wait, oh no, the elastic on my underwear busted.",4
Why?,5
"Everybody, this is Paolo. Paolo, I want you to meet my friends. This is Monica.",4
"Oh please, hell be with his real family, the twins and little miss new boobs.",5
"Hey, what do you want to drink?",4
"I mean we-we told Joey, he cried his eyes out!",5
Who told you that?,6
"You cant ask us son, thats cheating.",4
Feel better?,4
"Well, listen I ah, still have one more person to ah meet, but unless it turns out to be your sister, I think youre chances are pretty good.",4
It was in my room all night!,0
I cant believe were living here!,5
Is that Mark?,4
"No wait, look. Look! I'm sorry, it's just I've never even",2
Where've you been?,4
Are they in love?,3
Oh! I remember laughing! I laughed a lot.,3
"Aww, me too. Now let's finish this and go to bed.",3
Im sorry Joey.,5
"Plus, it was, it was probably mostly my fault, anyway.",5
So why dont you give me your number?,4
Excuse me.,4
She mustve left.,4
"Umm, see, I was thinking maybe you two could switch apartments because Phoebe's more our kind of people.",2
"To tape the game? You do this every time Ross, youre",1
"Man to uh, me.",4
"This is the unit for you my friend. Sturdy construction, tons of storage compartments, some big enough to fit a grown man.",4
Oh! Maybe its because Im on television. Im an actor on,3
"Its not for me, its for Rachel.",4
She is?,6
"So Lizzie, are-are-are you planning on staying the night?",4
"All right, okay, this is great, uh, Chandler, you get behind the desk.",4
"No, Im not mocking you,  or you beautiful guest room.",4
"""You wanna go over to Joey and Chandlers?""",4
Four hours? You guys have been doing this for four hours?,6
Here's my retainer!,4
That cup is mine!,0
"She, she buys clothes from stores that I'm intimidated by the sales people.",0
"Oh, its so easy for you I mean, youre not married, you get to have sex with who ever you want!",1
Oh that was a real person?!,6
So Im gonna go through the hotel and see if theres any other weddings going on.,4
"So, does that mean the audition is off?",5
Why are there only two of you?,2
"What, wait, you mean like this?",4
"Yeah, I do.",4
"Yeah, save it for the cab, okay.",1
With them Im one hot chicky.,3
Ewww! Oh! Its the Mattress King!,1
"It's okay. Chandler, are you afraid of me or something?",4
"Yknow, you look familiar. Do I know you from somewhere?",6
"Okay, good bye!",0
"Push 'em out, push 'em out, harder, harder.",3
Gin.,4
"Yeah, I understand.",4
"Honey, it isnt good luck.",4
"I just came over to drop offnothing. So that weekend kinda sucked, huh?",4
"Oh hey, Pheebs!",3
"I know I have this weird thing where I want everything to be in the perfect place, but I'd never expect you to worry about that.",3
A new grocery store.,4
Bye!,4
"Y'know, I gotta tell ya, I just",4
"Let's try it again, and this time let's watch everybody watch Joey.",4
"Alright, well, be good, I love you.",3
"Please, clean my beakers. I dont get out of the lab much.",4
I can't believe you would actually say that. I would much rather be Mr.Peanut than Mr.Salty.,6
"Well, if you dont have anything to copy, why are you going down there?",4
Is not.,0
"Ohh, y'know I-I heard about what happened, that must have been just terrible for you, losing your mother that way.",5
"Oh no, I know I couldnt see it either at first, but its right umm  Ross, I lost it again.",3
"Hello? Hello? Oh! Rachel, it's Paolo calling from Rome.",3
So based on your petition you are seeking an annulment on the grounds that Mr. Geller is mentally unstable.,4
Ive been waiting for this for months!,3
I bet he can.,4
You're kidding.,6
"Thats horrible! Well, you did the right thing man.",1
I dont think so.,4
Is this about Mark?,4
"Yeah, are you just going down there to gawk at that hot girl with the belly button ring again?",0
"Ohh, man! Chicago, is sooo lucky!",3
"No, there are great pictures of you standing next to a guy whos going like this",4
"then a little more custard, and then bananas, and then I just put some whipped cream on top!",4
"Oh Chandler, I know, I know... oh, hey! You can see your nipples through this shirt!",5
Hows your room Rach?,4
"All right, I havent lived here in a while, so I have to ask you something.",4
You went through all this time and effort to make this tape for me!,5
What are you guys doing?,4
Oh my God! Joey!,6
I guess I was just so worried about having to...    come here and do... 'that'...,5
Hey! So how was the doctor?,4
How could you not tell me that she has hair?,6
"Okay, after I get rid of this dirty diaper Leslie, Ill set you up with a clean one.",4
This sounds like a hernia. You have toyou-youGo to the doctor!,6
Hey.,4
Im Doctor Monkey!,0
"Then he comes over!  ""Im so worried about you."" Uck! Be a man!",1
"Yeah, we ended up spending the day together and had such a great time!",3
"Oh, I uh, just came by to pick up my skull. Well, not mine, but...",4
Here you go honey!,3
"Well, apparently not, and I cant just stand by and watch two people I care about very much be hurt over something that is so silly.",5
"Uh, you gotta press the button.",4
Have you figured out what started the fire Mr. Fireman?,4
"Hey, you guys. Listen, Im sorry that I was hogging the game beforeOh my God! Your friends have some unfortunate initials!",5
Cat.,4
"Amazingly, that makes sense.",3
"Hey Ross! Listen, do you want to go see that new Imax movie on tide pools?",3
"Okay, Im gonna take that spit bubble as, ""Yeah, I do!""",4
"Hey, Mon, if you were hoping to sleep with Joshua the first time tonight, which one of these would you want to be wearing.",4
And I don't even know how it happened.,5
"Oh, and somebody can get those leather pants shes always wanted!",3
"Okay, first there is a Chilean Sea Bass prepared with a Mango relish on a bagWhy is nobody writing these down?",4
"What are you just some big, dumb, stupid, doofy idiot, with a doofy idiot hairdo, huh?!",0
I cant find garbage bags!,0
It-it is broken!,0
Theres a dude?,6
"Oh, let me guess some idiot on a cell phone wasnt paying attention?",4
Sit.,4
Wait. Give him a minute.,4
Alright were back! Ten seconds left here we go! Ten! Nine! Eight! Seven!,3
Welcome to Las Vegas.,4
"Oooh, Im afraid that does not exist.",4
What do you have against the beautiful guest room?,0
I know!,0
What?! Anything! Anything!,3
It tastes like feet!,1
I talk in my sleep.,4
Laundry. Huh. Is that my new nickname?,3
Rachel! Im never gonna think its okay for you to cheat on your husband!,0
"Oh, oh thanks. Alright well, now that I'm up I'm going to go    to the bathroom.",4
Yeah. Oh! Was how you invented the cotton gin?!,4
"Ross, we can handle this.",4
Why would the baby creep me out?,0
"Okay! Feel free to look, but Im telling you those contracts are not on this desk.",0
Or Joseph.,4
"Okay, whatever, I really havent thought about it that much.",4
...I can begin to trust you again.,0
You are falling fast asleep.,4
"Okay, nows not the time Joey. All right? You can yell at me tomorrow.",5
"Umm, about that-that-that last move where the woman tripped you and then pinned you to the floor, what-what-what-what would you do next?",2
Not a problem.,4
Do,4
"No-no! Big bear! Big bear outside! I think I-Iwould youactually, would you go check on that?",2
Thanks.,4
No-noReally?!,6
Oh my god.,6
And my husband  hes a lawyer!,0
"If they cant find a home for her, they kill her! And Im not gonna let that happen to little Yasmine!",0
"Yeah, and and, I'm just gonna pay for this with a check.",4
"Yeah, y'know the ah, the girlfriend I told you about last night?",4
"Yeah I know, and I bet you thought it would be weird. But its not!",3
I guess I didnt really think about it.,4
"Oh yeah? Well, howd she take it?",4
Two.,4
"Shh. He did it. He told her off, and not just about the kiss, about everything.",4
Shh!,0
"Yeah. Well, I think our second fight is going to be a",0
"Now, that's trash. Young lady, you can't  Hey! Stop that young lady, she donated trash!",0
It is a crime that you and I don't spend more time together.,4
Hands.,4
"Okay, I-I d'know, you-you just- you have a quality.",3
Huh? Uh,4
"Well, yeah.",4
Okay. I just wanted them to hear it from somebody else.,4
Isnt that mine?,4
Okay please tell me that this is just one of your jokes that you do that I dont get.,3
can you excuse me for a minute?,4
"The only way that I said six would be if the sevens, let meet at seven, not at six.",4
"Hey Monica, it's Joey!",3
Gimme them!,0
"Well, as old as he is in dog years, do you think Snoopy should still be allowed to fly this thing?",5
This is going in your book?,6
"Oh, by the  way.",4
"Well actually, I know what time Chester and Marcia said.",4
"Well, were really not that close.  Okay, so I guess this is uh, good-bye then.",4
Hands!,4
"You really, really need to get some sleep, honey.",4
"Which is funny because in high school I uh, I-I failed Biology and tonight Biology failed me.",2
I know! Phoebe is gonna love dressing them in these!,3
"So, um, have you told your parents?",4
"Oh, it's so much more fun with you.",3
"Wow, this is so cool, you guys. The entire city is blacked out!",6
Whoa!,6
: Yeah!,3
"Oh, wait a second! I didnt say I wasnt free!",6
Did he call?,4
Can I help you?,4
Yes! You are so smart!  I love you.,3
Two people screwing in there  if you want to check that out.,4
Ben! Ben! Ben!,3
"Im not supposed to drink coffee, it makes me gassy.",4
"Well Im sorry, I thought you said it was okay.",5
"Well, I'm totally over it Chandler. Friends forever! Don't come out here!",0
So do I.,4
"No, no. He said ""When are you gonna grow up and start being a mom?""",4
"Yeah, come here!",4
Thank you. All right.,4
No! They are mine!,0
Hello?,4
Stuart!,0
"Oh, Monica. You are not still going over that thing.",5
Mmmm. Good.,3
"Oh yay! Great! Okay, what room number is he in?",3
I played bad on purpose guys.,3
I totally understand.  Can I,4
Previously on Friends.,4
"Yeah, there you go!",3
Crack isnt even an intravenous drug!,0
You stole them from me!!,0
"Push, push!",4
"Ooh, an ink stain! Hey, can I watch how you get this out?",3
Leslie?,4
Yeah! Okay!  Hey! Hi!,3
"What are you still doing here? She just broke up with the guy, it's time for you to swoop in!",6
"Oh uh, one of the writers.",5
Yeah. No. No...,0
"Uh, okay, and then you buzz Ross and I.",4
"Yeah, I feel kinda bad for them, but Im also really psyched cause I dont have to move in here!",3
"Oh anyway, I just wanted to say how wonderful I think you are.",3
"Umm, hows it going with you guys?",4
"Very cold, hard, unyielding, y'know nothing,",4
"Oh, I wish there was something I can do to make you feel better.",5
"Okay, okay, but Rachels gonna be here too, cant I just ask her this stuff?",4
Yeah. I really like his glasses.,4
Are you kidding? This is where they get out stains! Okay? This is like,3
Of course!,3
"My roommate bet me five bucks that I couldnt, and then he stuck a board through the handles that locked me in.",4
"Once you, once you betray me, I become like the ice woman, yknow.",4
Awkward? Why should he feel awkward?,6
"Hey, dragon! Heres your tips from Monday and Tuesday.",4
"Me taking care of you is no problem, huh?",4
What are you talking about alone? What about Ross?,6
I dont know.,4
"So I moved everything around and then I forgot where it, where it went back and I'm sorry, I'm very sorry, I'm sorry, I'm sorry.",5
"Ah...ooh! Well, looks like, uh, we kicked your butts.",3
"But we-we didnt havesex-uh, did we?",2
"Oh God, you saw me?! Oh!",6
Sure.,4
"Whats all this about you guys fighting?! Is this really over a room?! I mean, that is so silly!",0
"I, ah, I never said hate, I was very careful about that.",4
"No-no, she kicked our butts. You could be on the Olympic standing-there team.",0
"All right, bye!",0
"Aw, come on! It'll be years before I forget you!",4
"Well, it does not ring a bell with me...",4
Yeah! Help me get this mini-fridge past the security guard.,4
Those contracts absolutely had to go out today!,0
Wow! Skates!,3
Ewww!,1
No?,6
"All right, but I should warn you, Im not going. Im going.",4
"Hey, Pheebs! Check-check this out.",3
"Look, Im just gonna be across the hall, we can still do all the same stuff.",4
"Pretty cool, huh?",3
"No-no-no-no-no,  I'm not fallin' for that again.",0
I know what time you said.,3
Can I borrow the phone? I want to call my apartment and check on my grandma.  What's my number?,4
"Uh, I dont know.",4
"This photographer, who seemed really dull.",4
"No, she's at a faculty meeting.",4
"Okay, Ben, I wont tell your daddy that you had ice cream for dinner, if you dont tell about our little bonking incident.",2
"Oh, theres banana on it.",4
No-no-no-no-no-no-no-no!!! You can't come in here! R-r-r-r-Ross is naked.,6
"Thats good. I got to admit, I thought it was something else.",3
"Everybody smile!  Okay, thanks a lot! Enjoy your stay at",3
"Well, if you want, you can work here.",4
"Okay. So well Ill umm,  Ill have her home by midnight.",4
"Yeah, sure, thatd be great.",4
What stupid thing did you do?,4
Why wouldnt ya? Erin is great! Then-then theres you guys.,3
"Listen uh, Id prefer it if you didnt call me Joey.",4
"No, no resentment, believe me, it's worth it.",4
"God, its gonna so weird like when I come home and youre not here.",5
Okay .,4
"Well umm, if you have sometime yknow and maybe you might want to visit someone else",4
Guess what?,4
"Let's get that ball and really move, hey, hey, ho, ho.",3
"Oh, that is so sweet!",3
"Oh yeah, Smokey Joe here got half way to the highway and collapsed.",0
Which is why,4
And I-I am just trying to figure out why.,5
Its my sister.,4
"I make $1,600 a week doing what I do; any of you guys make that?",0
"Ohh, my new assistant is working out, yes.",4
"But, it seems to me it's pretty much like anything else, you know, face your fear.",4
"I know, it was the best I could get out of them.",4
"Oh, these are gonna go in my permanent collection.",3
"You know what, where he hugs you and kinda rolls you away and... Oh... my....God.",1
"No seriously, yknow the contracts I gave you, did you overnight them?",2
"Awww, one of my students got an audition. Im so proud.",3
"I see. Yknow umm, Phoebe makes sock bunnies.",4
Go!!,0
"Good, good, good, good, good.",3
You want some coffee?,4
"Umm, she Rach, not it, she.",4
I did not cry my eyes out!!,0
This rooms available.,4
"Yeah, but they didn't ask me!",0
Now it also says here that you lied about your sexual preference before marriage?,4
"Ross, let me show you where the guest room is.",4
"Well, I just called Joshua",4
One more game?,4
I think I have an old band uniform from high school.,3
"Oh, you got me.",4
Awww.,3
"All right, don't be shy, any suggestion will do.",0
Y'know what?,4
We're here!,3
"Y'know, it's just gonna be the two of us, she spent all day taking care of my monkey...",4
A lesson in the importance of unagi.,4
Chandler?,4
Come on Joey!!!,0
"But we haven't seen each other since then. Well I land in China, guess who's in charge of the dig.",6
Right!,6
"Okay. Okay, heres a good one of us.",3
Oh Im so sorry man! Is there anything I can do?,5
Okay. Ill be right back.,4
What is it?!,6
"Besides, somebody had to ride in that other taxi with the rest of your luggage, and your friends dont really seem to care too much that youre leaving.",5
"Sure, your dresser is missing but this she notices.",0
Canceled?!,6
Sorry. Monica and Chandler are making love.,4
"Oh, yeah, yeah, sure. We live in the building by the uh sidewalk.",4
Im next!,0
What? So now Im not allowed to fire him?,6
"Oh, oh! It's on again!",3
Someone in there?,4
What the hell!,0
"Yeah, you should, really.",4
No. Sorry.,5
"All right, so, what are we supposed to call you?",4
What?! Youre crazy! Theres nothing sexual about the noises I make!,6
Are you just repeating what I'm saying?,0
"Okay, Ill see you in our room.",4
What?! Oh.,6
Pat the dog. Oh! Oh! I get it!!,3
"You, get out of my shop!",0
"Im sorry Chandler, yknow you are such a sweet guy and I, I dont want to hurt you.",5
"Yeah, yknow. Happy holidays from Mona and Ross. Itll be cute, okay?",3
"You just take a big, big swing.",4
"Here we go, here we go.",4
"Okay, so what name am I cool enough to pull off?",6
You're there for her.,4
"Well, alright, we already tried feeding her, changing her,  burping her, oh try this one!",5
"Well, y'know, you and me, it had to end sometime.",5
"Well, I'm not I'm not at all surprised they feel that way.",4
"Yes!! Yes! Yes! Yes!! Thats my Dad, thats Frank! Yeah! Im sorry Im getting all flingy.",6
"Okay,  umm, why dont, why dont you all start to read, while I",4
"Yes, I do.",4
"Ah, Gunther, I cant pay for this right now because Im not working, so Ive had to cut down on some luxuries like uh, payin for stuff.",4
"Nice to meet you, Chandler Bing",4
Ive just been thinking about how my baby and I are gonna be all alone.,5
Aw come on Phoebe would you just think about it?,5
"Kay look, if I have to go to the doctor for anything its gonna be for this thing sticking out of my stomach!",0
"Oh, mostly fashion, so there may be models here from time to time, I hope thats cool.",4
You talked to him. Are you crazy?,6
Oh my God. You guys! You gotta come see this! There's some creep out there with a telescope!,2
It's creamier.,4
"Oh no-no believe me, Im leaving as soon as possible!",4
"Okay ladies, that ends todays class, and lets remember, lets be safe out there.",4
Joe...Joe...Joe...Stalin?,4
Do you have a chair with your name on it?,4
"Come on, wussies!",0
Howard's the,4
"Someone was in the lady's room, I couldnt wait. I left the lid up for ya though.",4
It's not a purse! It's a shoulder bag.,0
"Oh, just years of experience.",4
You cant marry him!,0
Really?!,6
"Oh, yeah, during the summer, I spend most weekends at my sisters beach house, which you are welcome to use by the way.",4
It is.,4
"The only person that should feel awkward is you, and you didnt tell him not to call me, did you?",0
"We're kidding. C'mon, tell us!",3
"All right, we'll start off slow. The only thing you have to do tonight is come up with the name of your main character.",4
London baby!,3
"That's nice. Get out Let's go, come on.",1
"Yeah, honey, maybe you can talk to somebody whos had a baby. Like your mom?",4
My God!,6
