Utterance,Emotion
The three losers.,5
Monica you really think I should try this phasing out thing?,4
What?! Excuse me!,6
You’re right.,4
"Yknow its like uh, Biology!",4
"Why, what happened?",6
"Look, I dont need to steal some stupid ring, all right?",0
Are-are-are Rachel and I not as close as you guys?!,0
"Yknow, I wish I could get him to open up a little bit, share some feelings.",5
"Here, come on, lets ahh, lets try it again.",4
Come in.,4
"Peach pit. That night we, uh- we had-",4
"Fine. Fine, alright, now you'll never know.",0
He went out with my wife!,0
"We share a wall! So either hes great in bed, or she just likes to agree with him a lot.",4
You chipped in?!,6
Theres just so much pressure.,0
"Uh, well yeah-yeah, I've got all of that going on.",4
You didnt bring,4
"So you uh, want to do something tonight?",4
"Oh, poor Lily.",5
I cant believe Im going to lose this job!,5
I can't remember the last time I got a girl to take care of my monkey.,5
Thats my wife!!! Get out!,0
"Umm, going to the beach. When it stays light real late.",4
Cant I just look at the handles on them?,4
I know. I like it up here.,3
I dont get it!,6
It's nine o'clock in the morning!,6
Bye guys.,4
"Oh, Chandler, Wayne.",4
It kicked! I think the baby kicked!,6
"Oh, what are you going to do, follow me down there?",0
Does it?!,0
Oh my God! What happened here? Did you do all this?,6
I don't know.,4
"Although yknow, he-hes a private guy.",4
"No, Phoebe, Ill tell you what, if you get ready now Ill let you play it at the wedding.",4
Hi! Its me.,5
No. No! No! No!,5
That bitch!,0
"Well, we are fond of the silliness, but we also have a soft spot for the love.",4
"Eh, do you believe that?",6
What did he say?,4
At the vet.,4
I dont know. Why? Did you hear something?,4
"Yes, but I wanted you to want to live with me, but okay, if you're having so much fun over here",5
Its Clint!,0
"Yeah, I lost it.",5
No more J-man and Channies!,5
"Are you kidding?! Another week with that sip, Ill kill",1
"Cause lets face it, were at Monicas.",4
"Your joke? Well, I think the Hef would disagree, which is why he sent me a check for one hundred ah-dollars.",4
Im leaning. This is where I lean.,4
"All right, let me in.",4
"Well, you might want to tell him it sounds like his wife is  gay.",4
Save it.,4
"Yay, okay!",3
"I have to go. Yeah, Carol should be home by now, soo...",4
Im sorry your wife is gay. I guess women arent that great either.,5
"Oh my god, I am losing my mind.",0
"No Joey, look. Trust me, all the men are wearing them in the spring catalog. Look.  See look,",4
I'm not a dropper!,0
"Theyre just ten blocks away, if I run, I can make it.",4
Oh.,4
"And plus, it'll give me something to do.",4
Go and tell Rachel right now before Ross finds out.,5
Well...,4
"Yeah, she was bald, shes not now.",4
Joey! Hes working!  You would look,0
Hey! Can you take a duck and a chick to the theatre?,4
Will the stable boy never get the princess??,5
"Well, people!",5
"And Mon, you wanna live with Chandler, dont ya?",4
"Oh my God! He's trapped in an ATM vestibule with Jill Goodacre!  Chandler, listen.",6
"Oh. Oh, its beautiful. I see it now.",3
And if you bring in one woman and she has her baby before me Im going to sue you!,0
"Two very good points, look Ive known you both a long time, and Ive never seen either of you one/millionth as happy as youve been since youve got together.",5
"And this actor guy, who Im not sure about, because when he called and I answered the phone Chandler Bing, he said Whoa-whoa, short message.",4
"Hey, Joey, could you pass the cheese?",4
"Rach, Im sorry, but you didnt give me any contracts!",6
"Hey buddy, do you think I can borrow your uniform this Thursday?",4
No ... the leather sticks to my ass.,1
"Thank you for your patience, youre the next caller.",4
I was just looking over next weeks script.,4
"Okay, heres where we go to the live shot of Times Square, nice work everyone thats a wrap!",3
Frannie was the one who found your,4
"Excuse me, look, we've been here for over an hour, and a lot of people less sick than my friend have gone in.",0
"No, I mean happy.",4
Well he made Rachel cry!,1
"I mean, I either keep my wife and lose one of my-my-my best friends or I keep my friend and get divorced the second time before I'm 30!",0
"Oh, how did it go?",5
And you know what?,4
"Oh its umm, its tofu cake. Do you want some?",4
"Please, just a little bit off the back.",4
"Well, how-how come?",4
You know what the Celtics problem is? They let the players run the team.,4
Where is Leslie?,2
So how are things going with Paul?,4
Okay. All right.,4
Oh absolutely. I like it even more on you than I did on Colonel Sanders.  Ross! Ross! Im kidding!,4
I told you not to go down there!,0
You do?,4
"Oh I see, so this suit is making a point.",4
"After that? Yeah! No, I mean if I can help.",6
"Okay, is this lamp in the same place?",4
Oh no!,6
Monica! What,6
"Okay, well then bring her in.",4
"Well, I don't know what else to do.",5
"Oh, by the way, that is her full name.",4
"Yeah, lifes pretty great isnt it?",3
Phoebe just because I'm alone doesnt mean I wanna walk around naked.,4
"Okay, fine, whatever. Welcome to the building.",0
They did it right there on the couch.,4
Youre right! Youre right. Dont say it.,5
Might wanna try Joseph.,4
I cant believe it! He still hasnt called.,0
"Then, uh, then we got dressed, and I-I... I walked her to the-  -the bus stop... I'm fine.",4
Was she happy you gave her the job?,4
Excellent! What Rachel has shrewdly observed here,3
"Y'know, I can't believe I'm getting my nails done!  And",6
"Welcome everybody, welcome to Amazing Discoveries!",3
"A strong, confident woman.",4
"Who, Josh?",6
"You are a strong, confident woman, who does not need to smoke.",4
"Y'know, how did I get this reputation as a dropper? Okay? I'm",0
"Okay, who are you?",6
Fine!,0
Excuse me?,6
"Hey, when the music starts up again, I was thinking of maybe goind into the robot, yknow?",4
"Yeah, okay, give that a try!",4
I'll sneak over as soon as Ross picks up Ben.,4
"I cant-I cant stay here all night, and if I go in there shes-shes gonna wanna... do stuff.",2
"Anyway, look, I dont know about you and your jackets and your separate tables, but Ross is one of my best friends, and if I save him a seat, Im telling you, he",4
What is that?,6
"Oh, I can't believe my sperm have low motility because, let me tell you, when I was growing up they sure seem to be in a hurry to get places!",6
It's nothing to freak out about.,4
"816, thank you!",3
Are you sure? Ill bet theres another flight to Minsk in like,4
More tea?,4
Oh yeah? Howd yours happen?,4
"Well, I like that idea.",3
Hey! He beat ya.,3
"Yeah, well I might be if I had the supplies! I mean, I could do all this stuff. Only I don't.",0
Here we go.,4
"Yeah well, Im-Im a slut.",5
Its yours!,4
Oh?!,6
No way are you cool enough to pull of Clint.,1
"Okay.  Oh wait! Umm, did you send those contracts to Milan?",6
"Well, my apartment isnt there anymore, because I drank it.",4
"Say it louder, I dont think the guy all the way in the back heard you!",1
"Rach, look!  Oh, hi! Where is my strong Ross Skywalker to come rescue me.  There he is.",3
"What, so I can't lokk nice? There might be doctors there.",4
That's always fun to be.,3
Are you sure?,4
My mom never gave birth. Oh! But my birth mom did.,4
"All right, hold on okay? First thing's first.  Okay, now did Ross sit",4
Really? You'd-you'd do that for me?!,6
"Remember, evolution?",3
My whole familys from Naples!,3
"Yeah, you should.",4
Yknow I dont understand why they didnt cry. It was a beautiful speech.,5
If you're afraid of bugs.....get a bug.,4
How about you?,4
Would you like to go out and have a cup of coffee?,4
"In the afternoon. Mr. Zelner came into my office after lunch. He put them on my desk, and then I put a",4
"""You are ideally suited for a career in data processing for a large multinational corporation.""",0
"Ohh, God, nobody likes him, and hes so cheap, hed never fly to London in a million years.",1
"Hey, Peter!",4
"Well, I heard that you thinking about asking Phoebe to move in with you and I thought maybe, we should have a talk.",4
Is it okay if I finish the apple juice?,4
"Hey, you dont have to smile. You just have to dance.",4
For the ride.,4
"Oh, let me get this.    These are for you.",4
"Gunther, y'know what, I am a terrible waitress, do you know why Im a terrible waitress?",0
"No, Im afraid I wont be able to make love as well as him.",0
"I dont know, I hardly ever say that about people.",4
I thought it was gonna be a closed casket.,4
"Oh, DAMN IT!",0
Will you stop!,3
"No-no, they just had a big blowout over what to do with my room.",4
"Wow, it is easy.  Now, I can have milk everyday.",6
Ask again later.,4
"Hey dad, what's up?  Oh God. Ross, it's Nana.",5
"Yeah, people get pretty generous around the holidays. And it never hurts to wear tight trousers.",4
Rachel has those in burgendy.,4
"Good. Good. Not that we dont want you to stay, obviously youre welcomeHow much more homework do you have?",4
"Can-can I get your autograph, Im your biggest fan.",3
"Oh myThis is so embarrassing. Oh my God, Im never gonna get massaged again!",2
"Oooh, wrong answer.",4
Whaddya think? Today's the big day!,3
Someone in here.,4
Dont you have to use the bathroom?,4
"Oh... Italy, I think.",4
"Plus, Im a doctor, and I had a monkey.",4
You forget how many great songs Heart had.,4
I-I studied evolution.,3
Where  Where you will seea uha bunch of uhred spots.,4
What?! You got us evicted!!,0
"Sweetie, with you its gonna be different. The sex is gonna be great, cause you-you guys are in love.",3
"Okay well then, Ill fire him today and you go out with him for another week.",4
I'm trppd... in an ATM vstbl... wth,2
Which one? Was it bald or was it tall?,6
You are now completely asleep.,4
Hes in room 816.,4
"What? My hands are totally clean, I just gave the duck a bath.",4
Much!,3
"Oh, I would love to!",3
"Okay, how long was I watching that woman?",4
"I'm sorry, man.",5
"Umm, all righty, before we get started I justI need you to state for the official record that you are in fact Frank Buffay.",4
And then the florist phoned to say there arent any tulips.,4
"I mean, what about those",4
"See ya Phoebe! Oh and hey, thanks for chipping in!",3
Dr. Drake who?,4
"So um, so what's up, you came to see me yesterday.",3
Oh myOh good God!,6
I didnt mean to scare you.,5
I'm gonna have to give him up.,5
Where there is no fear of commitment.,4
DO YOU?,0
"Oh dude, don't worry about it, I found an unattended maid's car.    We're way ahead of the game.",4
Whats fish hooking?,6
Joey I can see you okay? Youre hiding behind the coats.,4
"Okay Rach, before anything happens  I just want to lay down a couple of ground rules.",4
"Really well. Yeah. Surprisingly well. Yeah, she didnt cry. She wasnt angry or sad.",4
"Oh yeah, that's right!",0
I mean hi.,4
"Uh Phoebe, what she makesthats uhtheyre sock rabbits.",4
Theres nothing sexual about this?,0
"You're not serious, I mean, you really... you really talk to it?",6
I totally forgot about tonight and the fact that were supposed to,4
My God! What happened to you?,6
"Oh umm, theres also a book here by a woman named Wendy Bagina.  What is that?",4
"By the way, Chandler. I cut you out of all my pictures. So if you want, I have a bag with just your heads.",0
"Yes, and I was saying the actual words.",4
Who am I gonna meet in a blackout?,0
"Now wh-what is more important, love or silliness?",4
": Step away from the crib,    I have a weapon!",0
"Way to be cool, man.",4
That part was perfect for me! I can't believe I didn't get it!,0
What-what was it you were gonna tell us?,4
Rachel always cries!,0
"Not this hospital, Im going to sue you!",0
"Thanks for the coffee, or bedankt voor de koffie, Gunter.",4
Hey!  Hey!,3
OK.,4
"Honey, if you wanted to do that, you might as well just gotten him a fish, you know how fish freaked me out!",1
Thats laughter.,3
"Hey, you guys! Guess what?",3
"All right, all right.",0
"No, I mean tonight, in the building. Suddenly. Into our lives.",4
"Oh, I was thinking about having people over for the game.",4
"All right! Ill try! But if I cant, you can stay with Chandler and I until you get settled.",4
"Whoa, I'm sorry. Excuse me. We had this cart.",0
Wait!,6
"Ah, the forbidden love of a man and his door.",4
"Like you, I dont even know where you work?",6
"I had to have one last kiss, and also-also you said that you were going to leave right after I got on the plane!",5
"Yeah, but when the baby comes shes gonna want to move.",4
Why do all youre coffee mugs have numbers on the bottom?,6
Here you go.,4
So what does this mean?,4
I mean sex does not have to be a big deal!,0
"Oh, okay.  Hey, two beers.",4
"Yeah, I mean, come on Ross, no one will even notice. I mean they’re probably not even listening!",4
"Ow, no woo-hooing, no woo-hooing.",0
Good.,4
All right.,4
Are you mocking me?,0
Why do you do it?,4
"Well, I then guess Im going to Yemen! Im going to Yemen!  When we get to Yemen, can I stay with you?",3
"All right, all right, Ill go sleep with my girlfriend. But Im just doing it for you guys.",4
"Oh well, its not so bad.",4
"I never sucked, I actually didn't want you to know how good I was!",4
"No, Pheebs, listen, if you decide to do this, well be supportive like crazy.",4
Does that seem like something you can do.,0
"What do you mean, theyre not moving in? They-theyre still moving in right?",6
"No way! Mr.Salty is a sailor, all right, he's got to be, like, thetoughest snack there is.",0
What do you need?,4
I mean what?,0
Little village people.,4
Hey I got one! I got one!,3
"Hows that coffee comin, dear?",4
"I know.  Yeah, his name is Pat.",4
"Oh you know uh Kash, really liked you the other day. He said he thought you were charming.",4
"She is kidding, but don't ever disagree with her again. Okay, now I'm kidding!",3
"Hey Ross, look what I've got going here.",4
"What do you think you're gonna do, have sex with her right here    on my couch?",1
"Look, we have enough, just walk away.",2
"Oh thats great! Okay, well Ive heard everything I need to hear. I just need to uh, Leslie",6
"Guess what, I got an audition!",3
I'm sorry there wasn't better news from your test last week but I wanted to talk to you about your options.,4
Ginger.,4
"Did you, did you",0
"Yeah, and it really freaked me out! And after a while I even tried to hurt you and it just spurred you on.",5
I think shes trying to pull a fast one on Big Daddy!,0
It looks like a women's purse.,4
"Oh, I think I saw some in here.",4
She spent three hundred dollars on art supplies.,0
"Chandler! It happens to lots of guys! You-you-you were probably tired, you had a lot of champagne, dont worry about it!",5
I mean theres no way Joeys gonna make it in time.,2
"Ohh, I know one thing!",3
"When Mom and Dad drove you to the hospital to get your nose fixed, I swam into the lake and fished it out.",4
"Okay, well you are just gonna have too, okay.",0
"What. Oh no, you just rolled over the juice box.",5
"Oh okay, lift it straight up over your head!",0
"Nope, sound like me. Pheebs, its going great. Look at Chandler with little baby girl Chandler.",3
"So, I hear, you hate me!",0
So what did he decide? Does your Uncle Nathan get an invite or not?,4
"Whoops.  Oh, hey, do you need help with that?",4
"Oh, thank you thats very helpful, Im glad you came over.",4
"Uh yes, heroin and crack.",4
"Well, that makes me feel so good.",3
"Okay, hating this.",1
Does anyone else think David Copperfield is cute?,4
Do you really?,4
"Yknow, I dont have an appointment, but I sure could use a physical.  Are you sure youre okay?",4
"Yeah! Sure! Yep!  Oh, y'know what? If I heard a shot right now, I'd throw my body on you.",3
"Great, all right, okay, and Monica ask me to make the drumming stop.",4
Okay wait!,0
Ezel!  Hey Gunther! Youre an ezel!,0
"Hands down, best Abbey Ive ever seen.",3
"Wait, you guys think I stole some ring?",6
"Im, Im freaking out!",2
"Oh, I cannot believe hes using our divorce to sell mattresses.",0
"Okay, y'know your not though. Let's go.",4
"Im sorry I had to take such drastic measures to make my point, but Ilook, I just want you guys to be safe.",4
Joseph Stalin. I think you'd remember that!,3
"Well, y'know, monogamy can be a, uh, tricky concept. I mean, anthropologically speaking-",4
"Yeah, I Well I really actually wanted to say umm, that, but um, I figured I probably shouldnt because yknow, Ihave to leave.",4
Obviously!,3
Whats wrong with you?,0
"Ok ...  Well, uh, Joey, I guess    we have no problem.",4
Why should I help you?!,0
"Alright here’s something, it says to try holding the baby  close to your body and then swing her rapidly from side to side.",4
Hey!,3
"Sticky shoes, sticky shoes, always make me smile. Sticky shoes, sticky shoes, next time Ill.... avoid the..... pillleeeee.",3
"Yeah, I know...  ..I'm I'm just not that bright either.",5
"Oh its great, its a role on",3
Oh good!,3
"I mean do you have any fun, you know, fantasy type things?",4
"Look sweetie, I could be the bigger man, I could be the biggest man, I could be a big, huge, giant man, and it still wouldnt make any difference, except that I could pick your Father up and say Like me!",0
I got new sheets!,3
"So thats two boxes of the Holiday Macaroons. On behalf of the Brown Birds of America, I salute you.",3
"Oh, better, actually. Y'know I-I-I think I finally figured out why we were having so much trouble lately.",4
Wheres Chandler?,4
"Okay listen, just give me anything I can make two of.",4
I love you too.,3
"Well it turns out she ah, she wants to get back together with me.",4
I-I’ll go tell her now before Ross  finds out and I’ll be gentle.,4
"I was thinking maybe-maybe-maybe it could be a game room, yknow?",4
"All right, well finish your coffee; lets go.",4
Every moment is precious.,5
Yeah sure.,4
"I know, but that creep that I went on that date with goes to there so I have to find a new one.",1
"Okay, look at this one. This is my favourite.",3
"See my friend-my friend, Rachel, she wants to be set up.",4
"Hi!  Hi!  Hi. Has umm, anyone seen Chandler?",4
I believe you know my husband.,4
Okay!,3
"Uh, are you crazy? Are you insane? If you live with Phoebe, you two are gonna be y'know, live-living together!",6
"Its uh, right through there.",4
Thats what Monica said.,4
"Chandler, we said we would meet at the coffeehouse at six.",0
"No! No-no! He is totally incompetent. I called the chef who recommended him to me. He said, ""Ha-ha! Gotcha!""",1
"Chandler, theres a guy right over there.",4
I guess.,4
I feel like were the only two people in the world.  Oops. Sorry.,3
You said the baby.,4
If anything I'm making you look better!,3
Which,4
"Yeah, listen uh, I want you to make sure you tell Chandler that he couldn't have been more wrong!",4
"Whoa, for like months?",6
"Oh yeah! Yeah! Dont worry about me, Ill be fine!",5
"First theres a layer of ladyfingers, then a layer of jam, then custard, which I made from scratch.",4
"Joey, get out of the fridge.",0
Oh,4
"Well, I've never been through the tunnel myself, 'cause as I understand it, you're not allowed to go through with more than one girl in the car, right.",4
Im not arguing with that.,4
"Ohh, welcome to an adult relationship!",3
Lucky sixes....,4
"Yeah, well, is that",4
No.,3
"Whoa-whoa-whoa! Emily,  honey, okay?",6
Dont care what people say.,3
You wanna go in the bedroom? Its a little more comfortable.,4
Sit!,0
"Rachel! Well, you-youre not at home, youre-youre-youre right here.",6
"Actually, nectarines, but basically...",4
You be cool.,4
"Thanks, Im glad you see it that way.",3
"Like-like umm, regular coffee, Tequila.",4
"So I, I told Rachel it was just gonna be the two of us.",4
Yknow?,4
Whats the matter honey? Did you see a little mouse?,4
I got my hair coloured!,3
"Great! Its so amazing! I mean, last time Dr. Roger came over, I was",3
"Okay well, then well both do it today and hell just have to deal with it!",4
There shouldnt be all this rules and restrictions!,0
"Well, he better not come by here. He cant see the bride in the wedding dress.",4
"And then you realised if you  bitched about it, then you  would stop cooking, and you  would have to make your famous baked potato and Diet Coke.",0
"Car's waiting downstairs, I just wanted to drop off these copies of my book for your friends. Anything you want from Lisbon?",4
Thank you for a delightful stay.,3
"Ah, he cant make it, he said he had to his...  Whoa-oh!",6
"Listen uh, not that Im yknow insecure about my manhood or anything yknow, but I think I need to hook up with a woman like right now.",4
We said six!,0
"Okay, its not, its not.",4
Whos that?,6
"Oh,  I wish. No, you know he was just trying Ross's Hug and Roll thing.",3
"Awww, stop. Come on. Now go shave that head!",4
You can do it!,3
I am,4
"Yeah listen so, I thought I was getting better, so on my way home today I stopped by this guitar store and",4
Okay-okay!,0
"Oh, that would be Monica.",4
"Well, why dont you tell her to stop being silly!",0
She's distraught.,4
"Oh, I probably shouldntso I will!  Oh! Wow! Its like its raining!",6
"Hey, oh, you know that guy who's been following me? I talked to him today.",4
"All right, so are we not having dinner at all?",5
"Yeah, right away Mr. Kaplan.",4
It was funny til I started feeling like I was in a coffin.,4
"Ooh, you know, I had a grape about five hours ago, so I'd better split this with you.",4
"Im sorry, but I just wrote the best dance song for your wedding. Check this out.",4
"I tell ya, that has never happened before.",2
"You know, ever since I was little, I've been able to pick up quarters with my toes.",3
"Oh, um, Chandler?",4
What?! Tonight?!,6
And uh maybe you have to get used to it.,4
"Yeah, all right. All right! Just keep walkin'! All right?",0
Okay I understand.  I wouldnt want to be proved wrong either.,4
Could you press up too please?,4
Remember when you where a kid and your Mom would drop you off at the movies with a jar of jam and a little spoon?,4
"Come on, I'll only use my left hand, huh?",0
"Oh, Larry.",4
I also said number one.,4
"Okay, which one of you guys is Gunther Central-Perk?  Hey, Joey?",4
Absolutely!,3
"Monica, number one, I dont think Ben understands the concept of bribery, and number two, I...   What?!",6
"Yknow, Im not gonna play anymore,  would you, can you finish my set?",4
"Well lets see, there was the guy with the ferrets, thats plural.",1
Hes not here right now.,4
"So, keep having sex on a regular basis.",4
"No, I dont.",1
They are completely differentOkay!,0
I dont know if youd understand.,4
Yes! Its flown into your blouse and youd better undo your buttons lest it sting you!,0
"Well, every- single- second is like that with Aurora.. and I've just wasted about thirty-five of them talking to you people, so, uh.. Monica, can you help me with the door?",4
"He-he was with me umm, were playing a little game, yknow? Hide and seek.",4
Come on you gotta have one!,6
Or that.,4
Damnit!,0
"...I'm, I'm okay.",4
"Oh hey, Ross.",4
And you got a 'hate' from that?! Your taking a big leap there...,2
"Rach, I told you everything I knew last night!",0
"Yeah, I ended up in the storage room, and not alone.",4
There you go!,3
"Uh actually, sorry I cant even make it. Im seeing Mona again tonight.",4
"Yknow, give him my flower.",4
"Yknow, I know that I said that I am totally okay with Ross getting married, but as it turns out, I dont think Im handling it all that well.",5
If you give up every time you'd have a fight with someone you'd never be with anyone longer thanOhhh!,0
Okay.,4
"Im full, and yet I know if I stop eating this, Ill regret it.",4
Oh my God! Thats the creep that youre with at the,6
"Whoa-whoa-whoa-whoa! Is this, hot Rachel, that you took to the Christmas party, Rachel?",6
"I mean, that guy with the toe thing?",0
"Yeah, I said what was okay when I thought she was some weird bald chick. I mean, y'know, that girl has hair got",0
"Hey, that woman's got an ass like Carol's!  What? Thought we were trying to find stuff.",3
Oh yeah? Well maybe you and I should take a walk through a bad neighborhood.,3
It was just so awkward and bumpy.,4
"Oh, whatd ya bring me?!",3
Now let it go!,0
And how none of it matters when the people really love each other.,4
"Okay! All right! Now, Chandler you-you wanna live with Monica, right?",4
I mean you definitely should do that.,4
What's up?,4
"Oh God, Im so sorry.",5
"Oh, I so can't believe this! My uterus is an inhospitable environment? I was trying so hard to be a good hostess!",6
Shes not pregnant. Its Rachel. Rachels the one whos pregnant.,4
"Well, the cat... the cat turned out to be Paolo's cat!",4
I want to keep one.,4
"Yeah, you didnt expect her to live there with a baby did you?",6
I was wondering if you would consider coaching me for it?,4
Its only fair!,0
Dont I deserve a few tears?!!,5
Then don't touch one!!,0
Ow!!,0
"Look at this, look.",0
Together? Like-like to people?,6
"No-no, I-I have to see if this apartment became available.",4
"Well, we should go.",4
"There was a ring, in a box, on my nightstand, after you left, it was gone!",0
Sure. Okay.,4
"Nooo, I had to return it to the costume place.",5
"Well uh, his answering machine was",5
Great. Hes doing great. Dont you worry about Chandler.,4
"Yeah, you were, but you decided to make salmon because you had some left over at the restaurant.",4
What? What can't you do?,6
"Well, I never call",4
"Thursdays clearly not good for ya, pick a day!",3
"Hey, dinosaur guy, look at you, so sad. Come dance.",4
Whats the matter?,4
"Yeah, uh-huh, a 100 dollars.",4
