Utterance,Emotion
"What, he doesnt like Josh?",6
"Hi, how are ya?",4
"Oh thanks, but listen, I was just at Monicas and she and Chandler had a big fight and theyre not moving in.",5
"I mean you can buy old arcade games like uh, like",4
"Noo way, Kevin.",3
"No, but he told me, he thinks your a fox.",4
"Yeah, cheerie-o!",3
"About a month ago this guy spent the night with Rachel, I didnt see who it was but",1
There you go sweetie...     This isn't over.,4
"Eh, Monica it, it feels so weird, y'know, Chandlers your friend...  Oh!",6
I am a gentle person.,4
Oh my God! I know who the father is,6
And I too am just a love machine.,4
Thats not your regular dry cleaners.,4
"I mean gosh, Chandler what you did, it's, it's a wonderful thing and I really appreciate it.",3
"Hes not gonna make it, hes stuck in Chicago.",5
Yeah!,3
Remind me to review with you which pot is decaf and which is regular.,4
"Ah, thats okay, thanks.",5
Its your joke.,4
"Well honey, what about you?",4
"And its not fake, its totally brutal.",4
"Yeah, thank you Rachel, you are soo cool.",3
Wow.,6
"Yeah, I can say that I have a conference and you can say you have a chef thing.",4
"Hey, look, since we're neighbors and all, what do you say we uh, get together for a drink?",4
Whats your favourite thing about summertime?,4
Where are you Leslie?,2
I understand: who would cancel an actual date to go to a fake bachelor party?,4
"Oh, sure, they love us over there.",4
"Wait-wait-wait, do you, do you think, maybe we shouldnt invite her?",2
"All right, well the place was closed. Ill just copy it later.",4
You completely stole my answer!,0
Hell yeah! Ill marry you!,3
You're so pretty.,3
Dont look honey. Change the channel! Change the channel!,1
Hot coffee!!!,6
Woooo hoooo!!!,3
"No, but I want...I want the pinecones!",3
"Oh, really?",6
"Oh, I am, my side still hurts from when you crashed into me yesterday.",4
"Oh no, my dad's a doctor and he would always tell me just horror storiesabout ghosts and goblins who totally supported the princess's right to smoke.",4
What the hell happened on that beach?!,6
She really said that?,6
"Yeah, none of us have to deal with pressure at our jobs.",4
"Umm, Gene.",4
Come on! Joe!,3
"Joey, you have to tell her what’s going on! And what did it  look like?!",6
"She says as time goes on, he's gonna start getting agressive and violent.",5
"Im sorry, its just that youre so incredibly beautiful.",6
Hey-hey-hey!,3
Remoray. Its Portuguese. We need that information. Im a doctor.,4
"Oh yeah?  If I cant, Ill knock five bucks off the price off the unit.",0
Hey right!,6
"So, you heard it, you repeated it, so that must mean you wrote it.",4
But you-you understand how-how hard it is to forget about this.,5
"Don't worry, after a while he'll tune it out.",4
I feel violated. And not in a good way.,1
Hello.,4
"Sure, I'll go check on Emma.",4
Ohh!,6
"Oh, my mom called, theyre gonna run our engagement announcement in the local paper, so were looking for a good picture of us.",3
Joey Tribbiani.,4
Miss? May I help you?,4
Oh hey!,6
I dont think the next patient is very far along.,4
"Okay.  God yknow, if someone told me a week ago that I would be peeing in Joey Tribbianis apartment",3
Will you call him?,4
"Yknow what Tag, if we went down to the office you would see those contracts sitting on your desk.",0
This isnt funny!,0
What the hell was that?!,0
Is it better than the other salmon mousse?,4
Go get back on that case honey!,0
Coming through!  Oh! Coming through!  Oh! Hello! Hi!  No! Right! Coming through!,2
"People, people, people.",4
Its got all of these layers.,4
"Oh my God!! Do it!! Honey, youve waited",6
"Oh come on, by age seven kids have already seen orgies.  Was it just me?!",6
"Okay, but the moneys good, plus you get to stare at Rachel as much as you want.",4
"Yeah, oh hey, you are right on time.",4
Oh yes there is!,0
Absolutely! But you-you would really feel better about me rejecting you if your actor friend can audition for my movie?,6
Marry me.,4
Everythings ruined. My bed. My clothes. Look at my favorite blue sweater.,5
"Well, you broke up with Julie Grath! How much weight could she have gained?",0
Yeah,4
"Heres Frannie. Hmm, wont she be happy to see me?",3
Oh! Oh! That's so hard.,6
For Chandler!,0
Wow! Spinning that sounds like fun.,3
I don't see why not.,4
I just dont think arcade games go in the beautiful guest room. The beautiful guest room is gonna be filled with antiques.,4
You are not allowed to laugh at my joke.,0
"Yeah and if I had seven, maybe I wouldve said something like this, ""Wow! My boyfriends such a wise assseven!""",0
"Y'know, it's hand, hand, head, head,  up, pas de bouree, pas de bouree, big turn here, grand sissone, sissone, sissone, slide back, step, step, step, and jazz hands!",4
Im gonna give you my weeks notice.,5
But its absolutely your decision.,4
"Y'know I mean I-I-I'm an actor, I don't have the discipline that takes, y'know?",5
"Ohh, well, this is just perfect!",0
Molly ... people don't study acting ...,4
"And-and when she comes in hopefully, she wont recognise you because, well, why would she?",4
"Yeah, well, I had a great time with you.. I just can't stand your friends.",4
But in very different ways.,4
"Um, can you roll your tongue?",4
"All that stuff you said about true love, you were right, I mean, we did learn a lot from Mom and Dad!",3
"You know, I think I was sixteen.",4
"No, still too ethnic. My agent thinks I should have a name that's more neutral.",4
Like theyre taking it off the air?,6
"Well, it would be easier to move just right across the hall. Wait a minute, unless youre thinking about Naked Wednesdays.",4
"Oh no, Bonnies the best!",3
Oh yeah!,3
Hey. When you guys were kids and you played,4
The patient Im looking for has a broken leg and is in a wheelchair.,4
"Yes, I did. Thank you very much, it was excellent.",3
"Okay, umm, it's this tragic love story between Cathy and Heathcliff and umm, it takes place on like these really creepy mores in England.",5
"Sweetie, you think you can get in there?",4
Wow! I cant believe thats our baby.,6
"HeyOoh, hows Hilda? Is she working out?",4
